,0
369,if hillary was running as from a different state trump would have a fighting chance...shillary is officially 'from NY' even though she's a fucking carpetbagger who used NY to become a senator. so she's running as a 'new yorker' who used to be senator-NY and sec of state (from NY)...
370,"Same reason why London voted heavily for remain, they thrive off of globalism. It's why Bernie also never had a chance there."
371,I don't think it's because of the NY connection because Trump is as NY as it gets. In fact I bet more people know who Trump is/what he does than what Hillary actually does aside from being a former president's wife. I think it's more that NY is heavily Democratic and has a lot of liberal types in NYC in particular (a city that has more ppl in it than many entire states do). 
372,carpetbagger is a term for northerners who came south in post civil-war reconstruction.  Hillary is a southern who went north to exploit one of the highest concentrations of partisan cucks in the country.
373,Trump is a typical NY Republican.   But there are twice as many Dems in the state.  That's a big difference to overcome.   It'll depend on how disgusted they'll be with the Clinton corruption and crimes.  
374,"yeah...i use the carpetbagger term very loosely...i use it for any politician who slimes it up and goes to a different state and panders and pretends he/she is one of them, just like the historical carpetbaggers...robert kennedy was another carpetbagger who wasn't even from fucking new york and ran for the NY senate seat anyway"
375,Look at him making that poor baby pray to Allah! 
376,Probable virus! DO NOT DOWNLOAD!
377,"Picture worked fine for me, no virus. "
378,"It's a Webp image, guys.. Seriously, it's a file format, though not a popular one. Open it in Chrome, as Webp is one Google made. There is no download. It's asking you to download now because non-chrome browsers won't auto-recognize it as a viable thing. 

https://i.imgur.com/p7wf0cc.webp

OP linked this further down, copy/paste into chrome if you'd prefer. It's just Obama looking at a baby. "
379,FUCK OFF Virus faggot
380,Yea i just got a download and deleted.
381,"Nothing to download, just a pic.

https://i.imgur.com/p7wf0cc.webp"
382,Fucking thank you.
383,"Thanks bro, just a funny pic of him in prayer position on rug next to baby. Its a shit post. Nothing more nothing less."
384,Fuck you. Fucking Obama lover. Trying to hide the proof of him making America Muslim. Fucking cuck.
385,Changed file w file converter so I could post image thread. Reposted so no worry of virus. There was no virus. Can delete this now.
386,Nice lie since it's not a Fucking download.
387,I don't trust you
388,">.webp

Fuck off faggot."
389,Stop replying to your alt.
390,Fuck......my bad. High quality shitpost.
391,"hehe. It took me a moment to recognize it myself. People should probably get used to it.. I think Firefox announced they will be adding support a few months back. You can see a few Webp stuff on Facebook as well. 

No worries. I get people being skeptical, but yeah, it's a real format. :D
"
392,Dude your pic is a download........reported
393,If you wanna see pic I got it from the post of all those obummer pics. They fucked up and posted evidence of his wrong doing their. Look there if you don't trust me.
394,"Yup. That's an image extension, your Fucking point?"
395,Not my alt. Proving your ignorance again you Fucking cuck.
396,"Awesome, you ignorant Fuck. Its not a Fucking download. Have fun being an ignorant cuck you. Your prob jerking it to Hillary now."
397,"Nobody is falling for this shit, just waiting for your ban to come down."
398,"I'm not falling for your shit, your grammar says that your probably not an native english speaker either.  I'm willing to bet you're trying to get some poor sap to download virus's.  "
399,Dude stop. You're post has been deleted. Don't post downloads.
400,It's a download you russian fuck.
401,"It actually is a file extension.. Paste the link into Chromes address bar and it will bring it up with no download. Webp is a filetype google made that hyper compresses images, resulting in a smaller file size by like, 30% or some shit. 

"
402,Read ferlions comment for fucks sake.
403,Explain why he couldn't put his image in imgur?  The file says imgur but links to a download.  I'm not buying it.
404,"I really am not sure.. But it's pretty easy to test. As I said, paste it into Chrome (If you don't have it, sorry, I assume everyone has the big three browsers installed). It doesn't bring up a download box, it doesn't bring up anything but the picture, which is quite literally of Obama looking down at a baby on all fours in the oval office. 

I haven't seen a WebP file in ages, TBH.. But again, it's pretty easy to check.
"
405,I really don't plan to test this.  If he want's me to see the image so bad he'll post it to imgur and link it properly.  This is the first time i've ever come across this problem and I refuse to go any further with it.  If he posted it to imgur than linked it to imgur how did it end up in a file format that required a download?
406,"Because your browser doesn't support it. 

As a format, it's only been around for like, 6 years? Facebook posts occasionally use it, so it's not out of the blue. Firefox just announced support is being planned like, 3 months ago.. He probably posted it like that because it's literally a file type, and he didn't want to go through a converter.. 

But here.

http://imgur.com/4iXNc9w

Literally just a snip tool. He'd have to go online, find a converter thats free and doesn't watermark, ect.

He likely downloaded it as webp and cant change it locally. "
407,I'm with him.
408,dumb
409,A worthless piece of shit like you isn't rebuilding squat. Go look at some more porn. 
410,"We suspect your post is a troll post. Your post has been removed.

*I am a bot, and this action was performed automatically. Please [contact the moderators of this subreddit](/message/compose/?to=/r/The_Donald) if you have any questions or concerns.*"
411,You definitely sound like a *'bottom'*.
412,"This is the entire fucking point of the constitution saying that all powers not expressly granted the federal government fall to the states by default.   The federal government works best when it has the least amount of power possible.   For example,  there should be no department of education (I don't want faggots from California/rednecks from the south/cubans in Florida having any say in what my Philadelphia ghetto kids are learning about the world),  no irs (we should have about a 15% flat tax with no deductions or loopholes),  no FEMA (there should be a 'disaster czar' who coordinates the FBI,  military, and local law enforcement during a crisis), no VA (active duty military should tend to veterans),  etc.  

The size of the federal government is it's greatest weakness."
413,"I think there's an ever-increasing dissent between, not the North and South, but the East and West.  Alabama and Pennsylvania, for instance, are now more similar than say, Indiana and California.  The North has liberal areas, but as a whole, there's a sense of moderatism and respect that the West coast (as an observation) has lost completely.  "
414,"That is how it used to work, back when we were called a ""Republic"".
"
415,"That's fine if we live in a utopia, but we live in a world where China, with 4 times the US population, is using every bit of its growing power towards imperialist ends.  We live in a world where Russia is actively trying to destabilize and invade Europe again.

Division is the path to defeat.  Only by the peace-loving people of the world uniting, can we make it through this century intact.
"
416,Also competition and testing different ideas among states will help is find the most efficient methods of doing things. 
417,We can be united for national security but leave everything else up to the states. 
418,"National security doesn't exist without a strong economy.  A strong economy doesn't exist without good education and a clear regulatory framework.

China's not fighting to split itself into a million tiny, pathetic city-states.  Russia's not tearing itself apart for kicks.  The West needs to get over its little pouting party and realize we'll be eaten alive if we divide ourselves.  "
419,"United States.

The more freedom we have economically, the better.  Federal Gov't will only impose regulations, raise taxes, increase useless spending.  We get a limited federal gov't by giving the states more power.  "
420,"That was a sound bite that Trump has attacked, and rightfully so.  Commerce free of regulation, isn't necessarily best.

If companies need to comply with 50 different sets of regulation, then business is impossible, and only big businesses can operate.  That's why the Constitution has the commerce clause."
421,"NSFW?
also i think that only looks like the don"
422,Cant tell if this is sarcasm but yea its pretty racist bro
423,">Oh stop being dramatic it's a rape who gives a fuck she a lying hoe stop being a bitch nigga

Shieeeeeet OP."
424,"Yes, you are wrong for that. GTFO cuck. Go back to stormfront where you belong"
425,Obviously a troll 
426,Get this shit out of here...
427,Wow I guess I am a racist then
428,Damn son are u Hillary or some shit hacking my account? Damn son delete ya emails
429,But if anything your the cuck tbh
430,"Bitch nigga im ten steps ahead of u
"
431,Yeah on that ten step program dirty alcoholic Hillary! I know it's you drunkard bitch!
432,B b but.....muh ists? Muh isms? :(
433,"This triggers me...... 



Liberal cuck neighbor "
434,Yes and no.
435,So some people are serious and some arent?
436,"Not quite. More like we are serious and believe that which we say here, but we also tend to turn it up to 11 if that makes sense."
437,So you guys are just normal people that like trump but you guys exaggerate stuff?
438,">So you guys are just normal people that like trump but you guys exaggerate stuff?

This place is an online Trump rally if that makes sense."
439,"Also, just an FYI, because you posted here you are now banned from a half dozen or so subs. 

Liberals love them some censorship."
440,Okay
441,Lol I'm liberal but I hate censorship. And I know. I'm going to delete this. 
442,Cuck
443,Wow... that's insane. I though it was like 20% a few weeks ago.
444,">WizBang’s director, Mike Ciletti, is a longtime friend and former client of Lewandowski, having provided printing services for conservative group Americans for Prosperity when Lewandowski worked for it.

>As the campaign’s costs climbed, Trump officials complained they were paying WizBang about $8 per T-shirt, a source said. Lewandowski blew up when the officials suggested choosing a firm that could print shirts at one-fourth the price, the source added.

Stealing?  Favoritism to friend who was making shirts if true.  Why would Corey blow up about that?  Why would he not talk to his long time friend about lowering prices to their competitors?  Manafort seems like he does not mess around."
445,"Why are you posting this neocon bullshit?
"
446,#I'LL THROW TEA IN YOUR HARBOR YOU COMMIE BASTARD 
447,deleted  ^^^^^^^^^^^^^^^^0.0030  [^^^What ^^^is ^^^this?](https://pastebin.com/FcrFs94k/72634)
448,"""From the Amazon & iTunes Category #1 Bestselling and five-star rated author of The Literary Genius of Lil Wayne comes an irresistible exposé of Donald Trump’s true motive in running for President of the United States"" - 'nuff said"
449,In that paranoid schizophrenic's mind he's probably been dating her for months without her knowledge.
450,"I'm not dating Lee Ann, I'm dating her shirt!"
451,[deleted]
452,"We suspect your post is a troll post. Your post has been removed.

*I am a bot, and this action was performed automatically. Please [contact the moderators of this subreddit](/message/compose/?to=/r/The_Donald) if you have any questions or concerns.*"
453,LOL Liberals sure love throwing tantrums. Sorry dad wasn't at home.
454,**LOGIC ASSAULTED**
455,I've heard Trump's straight.  But plenty of Trump supporters are gay if you're looking to get it On with a guy .
456,"#SORRY I THOUGHT THIS WAS THE ""LAST BASTION OF FREE SPEECH."" OR DO YOU BAN POSTERS WHO DON'T ALIGN WITH YOUR BELIEFS??"
457,Yes 
458,#YES INDEED
459,http://i.imgur.com/ufYixdT.jpg
460,"Killed her with undecideds and almost all polls. Broke fundraising records the next 24 hours. 

I'd say it was a good day"
461,"We suspect your post is a troll post. Your post has been removed.

*I am a bot, and this action was performed automatically. Please [contact the moderators of this subreddit](/message/compose/?to=/r/The_Donald) if you have any questions or concerns.*"
462,"Under Reagan, and Bush Sr. My fingers hurt to type this, but it didn't suck under Clinton either. It was Clinton's policies that have lead us to today. NAFTA, the easy mortgages, the tougher stance on the war on drugs, etc etc. It's been downhill from there. "
463,"When we were an industrial power and not dependent on the service sector for jobs.

i/e Before we started outsourcing jobs and screwing over Americans.

EDIT - Another thing. Don't equate a part time service sector job to a full time factory job that paid an honest wage. The two are light years apart. Lying politicians will point at their ""fuzzy math"" job numbers and talk about how great the service sector has been, its all a lie. "
464,"I think they mean the time when unemployment was so low that anyone who wanted a full-time job could have one, and a time when pay was high enough that women could stay home and raise their children if they wanted to, and when it was easy to work and pay your way through college as you went, and when young people could afford to move into their own place as soon as they graduated, and when young couples could afford a starter home. Maybe we could bring back that time.
"
465,"Trump added an extension a while ago as well. ""Make America Great Again and maybe greater than ever before"". It can be any time you want it to be, but the point is that it's not great right now to people who are voting for Trump. "
466,"Some people might say the late 1940s into the 1950s. Unemployment was low, urban decay had yet to occur, car and home ownership skyrocketed. America was a manufacturing powerhouse as its consumer goods were exported to the free world. NATO was newly founded, and our allies actually spent their fair share on defense. "
467,/r/AskTrumpSupporters
468,It was great before liberalism metasticised. 
469,[deleted]
470,"And even some of those service sector jobs are under threat to outsourcing, H1B visa abuse, etc.

In short, the globalists feel that Americans are overpaid, hence why a lot of manufacturing has moved away and they're trying to erode the service sector as well. "
471,"**Out you go. Come back legally through our big beautiful door.**

That's **2463** deported! ...and they said it couldn't be done.

Got to start somewhere! That's 0.08118% of the estimated 3034000 illegals in California!

*I'm a new bot. [suggestions or comments?](https://docs.google.com/forms/d/1w-sXnTQ9bIT3fCbDONoM5TqoTpLxixWuaXSErgPElGg/viewform)*"
472,We agree with his policies. 
473,"/r/askThe_Donald
"
474,So we can deport cucks like you. OUT! OUT! OUT!
475,Because he makes all the 'right' people crazy.
476,"R/askthe_donald 

We're deplorable and irredeemable, remember? "
477,"We agree with his policies. We agree with his tendency to throw PC to the curb. We agree with his love of this country. We vehemently disagree with Crooked's policies, and her backchannel dealings and political debauchery - but make no mistake. We are, by and large, not here because we disagree with Hillary... we are here because we wholeheartedly support Donald Trump, Freedom, Justice, and America. We are here because we truly want to MAGA. "
478,"You Must Vote TRUMP... 
   
Donald Trump is the True God Emperor of Mankind.        

"
479,I'd hate to be a brainwashed liberal like you. MAGA.
480,"His stance on nearly every issue aligns with my own, and he puts our country and our citizens first.  It's the first opportunity in nearly 3 decades to elect someone like that to the highest office.  Clinton, Bush, Obama, and Romney, McCain, Kerry, and Gore for that matter, were all just more of the same BS that's slowly killing us for the benefit of the donor class.

Plus, while Trump may say some things that are a bit cringe worthy, you can't argue with results.  The man is a freaking genius.  He picks fights with the media just to get them to fall into his trap, and give him millions in free air time.  I've never seen someone play the media with so much finesse, even if he looks awkward while he's doing it.  I want a man like that nimbly navigating the geopolitical landscape."
481,He's a genuine patriot that wants our country to succeed and he has the skill set necessary to make it happen. The US government is so corrupt that it's going to take a strong political outsider to break the stranglehold foreign and corporate interests have over We the People. President Trump is that man.
482,"Because he has given sound arguements and solutions on how to restore our economy and progress the country forward, while keeping a great deal of respect for the foundation of America. He doesnt come attached to 30 years of political scandas and blatant criminal activity or disregard for the little people in our great nation."
483,"Is this a serious question or is this whole thing a parody? I honestly can't tell. Would somebody in their right mind tell me why someone would ask such a stupid question when you have the entire world's knowledge available on the internet? You're either lazy or dumb, and I wouldn't care to be either."
484,"To me that sounds like you're voting ""against"" the other candidates. Isn't there a better way to do that than jumping on the bandwagon of somebody like him?"
485,"Apologies, I forgot to mark my post as ""Serious""."
486,Sometimes that has to be good enough.
487,She's speaking now. I'm not watching it though. Can't stand her voice and her constantly lying. 
488,Live on CNN now.  She's an idiot.
489,"**SEXISM SEXISM SEXISM DRUMPF**

There. You're caught up. "
490,"Remember when Al Gore predicted the Earth would scorch by January 27th, 2016? And people like you believed him? Then that day came and Climate Believers looked like idiots that we all knew they were?

[That was awesome.](http://thedanashow.files.wordpress.com/2009/06/al_gore_man_bear_pig.jpg)"
491,"An abandoned account... hasn't been used in a year... suddenly posts.

Hill Shill confirmed?"
492,The only jobs Hillary will ever create!
493,She probably just outsourced to the CCP 50 cent brigade
494,"Egypt's government is based rn, but they're bound by the money of the Gulf States. But their time is coming, the flames of Jihad will consume their land"
495,Gross 
496,"We suspect your post is a troll post. Your post has been removed.

*I am a bot, and this action was performed automatically. Please [contact the moderators of this subreddit](/message/compose/?to=/r/The_Donald) if you have any questions or concerns.*"
497,"You're ignorant.   When you make it to the 28% plus tax bracket, you might understand.   Keep plugging though.   "
498,"Clinton and her foundation, you're right: she's an asshole."
499,"Gtfo you cry baby if you were rich like the donald then you'd say the same thing....
MAGA TRUMP TRAIN NEXT STOP WHITE HOUSE TRUMP 2016"
500,"You say you don't want people to come in here with name calling yet you already have in your own questions. You seem to have already come to a preconceived conclusion anyway, so why ask it at all?"
501,"> I come in search of political discourse and not name calling or personal attacks.

> No, asshole, it doesn't make you smart, it makes you a rich dickhead that has smart attorneys that can weasel you out of paying your fair share.

You almost made it."
502,"trump owns real estate, he is required to deduct the depreciation from his solely owned real estate on his personal tax returns, this is why he pays little to no taxes.  

also, you sure don't sound like you know shit about the subject, and you sure don;t seem like someone looking for discourse and not name calling

also, you discount the payroll taxes he pays on his employees, which adds up to alot of money

so should he disregard irs rules and pay taxes on his properties both now and when he sells the property

because if he does not claim depreciation now, he will be paying taxes 2 times on his money

see, you don't know shit but you come in here calling people names under the guise of civil discourse

fuck off"
503,"Ok a lot of people are giving you crap, which i can understand since this isn't a sub Reddit for asking questions, but I'll answer it sincerely. 

Anyone who pays less taxes using legal loopholes should no be blamed for paying less taxes. That applies to any income bracket. Trump has publicly paid 0 to low income taxes and no one has arrested him for tax fraud so we can only assume he's done so legally. Thus, he is smart. He worked the system politicians made and got the best deal. It's a great example of how he understands our economic structure and where the loopholes are. He also has clearly stated in a tax plan how he intends to fix it. 

However if someone plays with taxes illegally and pays less, that's not okay. People like to frame the stance on taxes as only caring about the rich and screw the poor. That's not the case. In fact, Trump WANTS the poor to pay less- 0% income tax on his lowest of 4 brackets. "
504,"Very skewed polls. He's tied in two national polls and down by 5 (in the margin) of one. Plus, very competitive in the swing states and it's only June. This month was one of the hardest for his campaign while Hillary probably had her best and he's still tied with her. For comparison, Romney was down a lot at this point. "
505,"Article is misleading, Trump just wants to protect the bill of rights, like he always has. This includes religious liberty, freedom of speech, and the 2nd amendment.

Also, note that he said ""if congress passes it, I will sign it."" He has come out multiple times in defence of LGBT, saying that he will ensure that all Americans have the right to love who they want without fearing for their safety. Nothing to worry about.

Also, for anyone else reading this: OP only has 1 post. "
506,Good for him. 
507,Love it!
508,I'm good with it. Will probably make a donation today. 
509,"It's grassroots fundraising, which fits his goal of trying to be backed by the people, and not the special interests. "
510,Where's the tendies?
511,Beans are better than truckloads of Turks.
512,TROLL it's over hitlary lost just like you lost in the gene pool and like you lose at life. Go home and cry  to your mama.
513,Wait what
514,Why did you put together or find and post a video of Trump sniffeling? 
515,"Article 50 will happen when new leadership is in power.

A brexit government will take Britain out"
516,[deleted]
517,"The only reason to not invoke Article 50 is to buy/extend time to make all the preparations for the country to be ready out of EU.

Any other reason is just an excuse to delay time."
518,The other way to look at it is that senior EU officials are pushing for article 50 immediately - they want a messy exit to intimidate others. Doing it sensibly makes sense.
519,"Lol @ Sanders destroying Trump.

It's only because he is saying he will give away more free shit to everyone."
520,[deleted]
521,">Sanders


>win anything

Fuck my sides, please stop."
522,"No he wouldn't, barely any negative ads against him. Once he got one, he would drop like a rock. Wasn't vetted at all by Hillary or the media. Last time I checked it was around $50,000 to $67 million in outside negative spending against Bernie vs Trump."
523,">Oh no, some people have a different opinion from mine! Better act shocked and look for ways to discredit them rather than listen!

Signed, /u/DrGhostly"
524,"**Another goes over the wall!**

That's **2154** deported! ...and they said it couldn't be done.

Got to start somewhere! That's 2.65926% of the estimated 81000 illegals in Minnesota!

*I'm a new bot. [suggestions or comments?](https://docs.google.com/forms/d/1w-sXnTQ9bIT3fCbDONoM5TqoTpLxixWuaXSErgPElGg/viewform)*"
525,Because he doesn't lie. His words are taken out of context to make you think he's lying. 
526,"Use the ""ask the donald"" subreddit, that's the perfect place for questions like this!"
527,https://www.reddit.com/r/AskThe_Donald
528,"Because half the ""lies"" you hear about on the MSM are mostly truthful. The thing is, if any details are wrong, they claim they're lies. The media and Trump's opponents look for loopholes so they can claim he's lying without giving you a full picture.

Now lying, is say... Claiming you landed under sniper fire in Bosnia."
529,"We suspect your post is a troll post. Your post has been removed.

*I am a bot, and this action was performed automatically. Please [contact the moderators of this subreddit](/message/compose/?to=/r/The_Donald) if you have any questions or concerns.*"
530,"The man is less important than the momentum pushing him.  I don't like SJWs.  

SJWs picked Trump, like Voldemort picked Harry.


"
531,MSM are masters of context editing and name calling.
532,"Oh nice, didn't know that was a thing. "
533,"My dad has been accused of ""racial discrimination"" 100 times. Usually people claim that when they don't get the rental"
534,"kek <-- this one

kek

kek

kek

kek

kek"
