,0
0,"I don't care if he does, I care about his policies and resolve."
1,Illegal immigrants you fuckin half wit
2,ILLEGAL immigrants. Stop picking out words. He has NO problem with immigration as long as it's done the LEGAL way.
3,Go away.
4,"Can I ask the context of the quote? Usually when someone uses a 5 word quote they are being deceitful little bitches or they are too dumb to get the context. 

Where was this said even?"
5,That does it! I'm now a #CruzMissile!
6,"If you **ILLEGALLY** immigrated into this country, you commit a serious offense and drain the US's resources. Now, why do you think he shouldn't be strict with these rules. If you just allow anyone in, and they're never forced to leave (VISA), why is there even any laws about it. Fuck ut, why not just let everyone in. It doesn't matter if you are the worst human being possible...come on in!

P.S. others, I think he's trolling."
7,They deleted their account...pussies
8,Every single one of your comments contain something offensive to the poster...what does this say about who you support? 
9,*peaceful* diverse *kind* undocumented future citizens you shitlord
10,Said no one ever.
11,**BEYOND CUCKED**
12,We don't really give a shit 
13,The fuck man 
14,"If anyone can't see through the sarcasm that this post is drowning in, please euthanize them. 

For the record, the username checks out!"
15,Yawn.
16,"We found Comey's reddit user account.  Well, go through it and figure out the se ret message."
17,Jump in front of a bus. 
18,deleted  ^^^^^^^^^^^^^^^^0.2082  [^^^What ^^^is ^^^this?](https://pastebin.com/FcrFs94k/24432)
19,We might as well change the name of this domreddit to Burlington Coat factory with how many coats we are slingin 
20,"24 hours seems fair.  The smarter of the berniebots will join us immediately, the others may be too far gone for us to waste time on any longer.  I am already bored of BLM fluff, it's just a distraction.  We need to get back to praising our GOD EMPEROR and investigating the crooked house that Hillary built."
21,I see a new meme being born
22,archive.is for the lügenpresse
23,Just use an archive link. You can read your enemies without paying them. Jesus. Reported for shameless concern troll.
24,"use archive.is

Washington Post is filled to the brim with limp dick cucks. I wouldn't buy their children ice cream cones. "
25,[removed]
26,**VIOLOLOLINS**
27,"Lol if you think porn is going anywhere anytime soon.  They might as well say, ""let's get rid of the internet""

More likely it will be the far-left that ends up banning and censoring certain kinds of porn, anything where a man dominates a woman is gonna go bye-bye, you can count on it."
28,"WHAT?! I'm a libertarian (but without the open borders philosophy).


All three of these are BIG GOVERNMENT issues. We need to make the government as small as possible IMO.
"
29,Absolutely disagree with these points.
30,"Trump wouldn't sign anything into law at a national level on those issues, but he wouldn't stop states from banning those things.  What's your point?

EDIT: Why are people for men entering women's bathrooms?  Use the bathroom of your actual sex and not gender identity or dont separate bathrooms.  How hard is that honestly?"
31,"GET EM OUT, GET HIM OUT OF HERE! Get your cucked bullshit off this sub. Those issue are not a part of Trump's platform and never have been. "
32,What the hell are you talking about? You must talk to exclusively members of the Westboro Baptist Church or something
33,"> More likely it will be the far-left that ends up banning and censoring certain kinds of porn

Except that Trump's platform committee unanimously drafted it. The committee that decides Trump's presidential platform has decided he is to pursue banning porn. That is why I have made my post."
34,"**Another goes over the wall!**

That's **13019** deported! ...and they said it couldn't be done.

Got to start somewhere! That's 0.4291% of the estimated 3,034,000 illegals in California!

*I'm a new bot. [suggestions or comments?](https://docs.google.com/forms/d/1w-sXnTQ9bIT3fCbDONoM5TqoTpLxixWuaXSErgPElGg/viewform)*"
35,"> Those issue are not a part of Trump's platform

Please fucking read. The committee drafting his election platform have unanimously signed these things into Trump's platform after Trump declined to take part in the process of deciding what goes in and out, instead leaving a representative to observe. 

I made this post because I know these things don't line up with Trump's beliefs, Trump should get involved and get these things off the platform."
36,Trump is going to ignore their sorry asses and carry through on his promises to us. I don't give a shit what the cuck servtives have claimed. Fuck them and any propaganda they release. 
37,Friday
38,17 shell casings and three bullet holes? When BLM sends us their people their not sending their brightest.
39,Probably not. He'll want to publicize his pick as much as possible. I've heard maybe this Friday. 
40,C yoU iN Toledo.
41,"Notice me, Senpai. Notice me."
42,Well that's racist. 
43,"The less violent people we have on this earth, the better."
44,Fuck off troll. Take the race bate back to Storm Front.
45,"unarmed = 100% innocent 
according to the media.

In reality, grabbing for the cops gun, or using fists is actually very dangerous. "
46,"No.

No one unarmed should be killed by cops unless they attempt to kill a cop or others. The Trump Train is for Americans, not for hate."
47,Deported 
48,"#[NEXT STOP: THE WHITE HOUSE! THE TRUMP TRAIN JUST GOT 10,000 MPH FASTER!](https://www.youtube.com/watch?v=hgM2xN5TPgw#40587000)

#CURRENT SPEED: 40,587,000 MPH

That's 6.05219% of the speed of light (670,616,630 MPH)! Only 630,029,630 MPH left to go!

^^^^A ^^^^bot ^^^^by ^^^^/u/BotsByLiam. ^^^^Please [^^^^use ^^^^this ^^^^form](https://docs.google.com/forms/d/1HdOFBQ85C6qHKS8YdG0le6UiffBfj5saBM6qTp3ZAvQ/viewform#responses) ^^^^or ^^^^visit ^^^^/r/BotsByLiam ^^^^to ^^^^report ^^^^errors ^^^^or ^^^^make ^^^^suggestions!"
49,Michael Strickland isn't fucking around.
50,"Got to give it to Nintendo, they managed to get a snorlax in the video to promote their game. "
51,This is fucked up. Delete this.
52,This is terrible. 
53,Don't post this here.  We harbor neither racism nor hate.  OUT OUT OUT.
54,"**Another goes over the wall!**

That's **11508** deported! ...and they said it couldn't be done.

Got to start somewhere! That's 57.54% of the estimated 20,000 illegals in Hawaii!

*I'm a new bot. [suggestions or comments?](https://docs.google.com/forms/d/1w-sXnTQ9bIT3fCbDONoM5TqoTpLxixWuaXSErgPElGg/viewform)*"
55,"There's absolutely no context to the quotes, it could be from anywhere."
56,**DEPORT - OUT OUT OUT!**
57,"It's possible that he saw the business-end of the video, being that it was from Romney, but ever saw the actual context of the video. IE, an advisor told him, 'Mr. Trump, Romney's PAC put up this video of such and such'

"
58,This is about whether he saw an advertisement or not. Thought it would be something serious. The one with Bernie is way worse.
59,"""The supporters trust Trump more than they trust the media.""  

And that whole clip is proof of why that's true. Did you see how excited they were? 

'Oh, yes! We got his ass now. Aha! We caught him in a meaningless contradiction! Let's talk about it for an hour with a round table of seven experts.'  

Meanwhile, Hilary has been lying for YEARS in front of Congress, the FBI, the State Department and the American people about actions of hers that represent multiple felonies and breaches of the public trust. Yet the media is nowhere to be seen.

 ""No press conferences? Oh, that Hilary...she's so silly... let's talk more about how much we love her.""

"
60," Exactly, It could of been as simple as. 

First interview. ""This guy wont twist this on me, I'll talk about it"" 

Second interview ""I know you are setting me up, lets talk about something else"" "
61,"**and take your anchor baby with you!**

That's **11527** deported! ...and they said it couldn't be done.

Got to start somewhere! That's 37.18387% of the estimated 31,000 illegals in Idaho!

*I'm a new bot. [suggestions or comments?](https://docs.google.com/forms/d/1w-sXnTQ9bIT3fCbDONoM5TqoTpLxixWuaXSErgPElGg/viewform)*"
62,Have you paid any attention to Gary Johnson lately? He throws the same 'hurr racist' card at Trump that liberals do. No way he'd accept it and no way Trump would want him.
63,"I forgot to add, wife and I are voting Trump (registered Libertarians) regardless of his VP pick. MAGA"
64,"My brain is just in systemic damage to TPTB mode. And I know its a pipe dream. But having failed at getting elected so many times, a guaranteed VP seat would be a tempting cherry. Legitimacy for the largest third party. And just fun to watch the pundits got ape shit."
65,Pence supports the TTP.  He won't be Trump's pick 
66,"""a source with direct knowledge tells ABC News""


Come the fuck on. "
67,Fuck hillary wow 
68,"Unconfirmed, and you aren't the first person to post this bullshit. More like the 800th. Wait for Trump's actual announcement. "
69,Wait for Trump Friday
70,"Can't wait for Bernie supporters(AKA a majority of posters on this sub) to criticize the pick because OMG HE IS ANTI GAY!!!!

Deal with it.

My post being downvoted only confirms that this sub is basically all Bernie supporters who won't actually vote for Trump."
71,"He's also pro-TPP, and he endorsed Ted Cruz in the Indiana primary."
72,"No retard, we're upset because this would turn everyone ELSE off to him. Moderates don't like the religious shit, Pence gives no benefit and takes support AWAY"
73,"Muh gay

muh gay

muh gay"
74, I'm sure all the sheet rock it's made of caused  it.
75,Its not
76,http://sli.mg/zK46QZ
77,No.
78,It's not official 
79,"Urge to kill, rising...

THIS HAS BEEN CONFIRMED TO BE FALSE BY TRUMP HIMSELF! WAIT UNTIL THE ACTUAL ANNOUNCEMENT IS MADE. "
80,Stop citing Clinton News Network unless it's archive.is
81,Dude you need to cut this shit out. You can barely form a fucking sentence.
82,this is what sucks about politics! why is this even a thing? Still trump said to Jenner she can use whatever bathroom you want so I doubt pence changes that. 
83,I just hate being conservative-leaning LGBT because no matter what I hate both parties and movements for the stupid things they stand for and I see no major sign of change in the near future.
84,Everyone needs to stop white-knighting for us.  We don't care- we have our man.  Anyone doubting Trump because of a fucking VP needs to seriously re-evaluate their involvement in politics
85,"The ""Christian right"" homophobes are in the miniscule minority here in the Trump camp. Just know that their drivel is quickly becoming a thing of the past, and good riddance."
86,"We're mostly nationalist Rockefeller Republicans, just a lot louder."
87,We've let the religious right dominate the Republican Party for too long. That shit is OVER. 
88,Jesus Christ help us
89,The Muslims do that for fun. All the time
90,"Is this what you do with your life? Think about killing people? 

The left is insane thanks for confirming "
91,*Excellent first post.*
92,Weak sauce...won't go well w/your tendies.
93,Ohhh god....my eyes...
94,"""Sigh"""
95,r/fellowkids 
96,"Hope they all come and give her Magikarps

Dragon Quest Monsters is better anyways"
97,are you one of those dips that gets pissy when people say po kee mon instead of po kayy mon?
98,"Normally, no. But when a lying, murdering sociopath takes something you hold dear and swings it around to entice people too stupid to have been allowed phones, it gets to you."
99,I love it!
100,Like Trump was stuck with Pence the way Reagan was with Bush. 
101,I feel that he was denied by his first choice 
102,"It was a double,double bluff...."
103,"Still think he was playing 4D chess, allowed him to beta test Pence."
104,He hadn't made his decision like the media was reporting though. This decision was made probably Thursday night. 
105,"Feeling good, as always when in the Trump camp. "
106,Yeah of the three choices. Pence is the best MAGA 
107,Check out a game called Bro force on steam LOL
108,"The opposite of brick breaker, where you build the wall."
109,http://steamcommunity.com/sharedfiles/filedetails/?id=722120493
110,"I literally just planned out an entire platform game in my head with ""Build a wall"" as Wall Man's ability. I'm going to make that, who'd support the kickstarter?"
111,"Sorry!
An error was encountered while processing your request:

That item does not exist. It may have been removed by the author.


Here's a link to the Steam Community home page."
112,Fixed...
113,"Looks good. I said ""Yes"" to it."
114,MAGA =)
115,I HAVE NO IDEA WAT THAT MEANS
116,"I looked it up, it means Make America Great Again.

Hell yeah!"
117,;)
118,"Wall of text could use punctuation or delimiters. Otherwise, good list."
119,Not everyone has the same views as the LBGT community. 
120,"Trump's position on LGBT issues is to let the states decide. 

If Trump is only getting 76% of his own party then he lost already. Pence will help solve that problem. We're not the only ones they need to make happy. "
121,"Trump has no problem with the gay community and believes it is up to the states to decide, which you'd argue Indiana did decide how they wanted to handle religious freedoms. "
122,"no doubt, but everyone needs to be treated equally, religious/political views shouldnt have to be reason not to"
123,"that's the right thing to do: let the states decide.

but letting states violate human rights because of who someone wants to sleep with isnt."
124,"""religious freedom"" means taking away the freedoms of others, like buying cakes or coffee"
125,"Unfortunately a lot of people feel that way and Trump needs their votes to win in the first place. Pence should resolve that problem. 
"
126,"No it doesn't. The Free Exercise Clause would directly be in violation if a government forced its religious folks to do something against their religion. The RFFA does not ""allow"" discrimination on a state level. Additionally, the number of times where a business turned away the LGBT crowd I can probably count on my fingers. Furthermore, I would strongly argue that the way Indiana's RFFA is written it PERMITS government intervention into a religious issue should it be of interest in the state. Previously, it would be hard to do so."
127,"the holy bible also says if a woman is raped, she can be sold to her rapist and have to marry him. Should we also allow that in fear of violating ""religious freedoms""?"
128,"1) You have a HUGE misunderstanding of that section of the Bible. Hilariously huge, and I say this as an atheist.

2) That's not what these laws pertain to, so you have a grave misunderstanding of Constitutional law."
129,"Then do explain. The Bible makes it pretty clear cut along with all of the other atrocities found within its texts

Deuteronomy 22:28-29 NAB)

If a man is caught in the act of raping a young woman who is not engaged, he must pay fifty pieces of silver to her father.  Then he must marry the young woman because he violated her, and he will never be allowed to divorce her.

Not much to misunderstand from that. 
"
130,"First, that's from the Old Testament and thus isn't applicable because the New Testament is what counts. This is Christianity 101.

Second, back then culturally if a woman was violated before marriage she would end up homeless, not desired, extremely poor, etc. What you quoted is a way for that woman to avoid that nightmare. The payment as a fine and then he would have to support her for her entire life was cultural protection. This is also completely dependent on whether her father would permit her to marry (Exodus 22:17). And the man can never divorce her no matter what she does."
131,"Christianity 101? You're supporting their allowance of cherry picking shit from their fairy tales.

Matthew 5:17-19:

Do not think that I have come to abolish the Law or the Prophets; I have not come to abolish them but to fulfill them. For truly I tell you, until heaven and earth disappear, not the smallest letter, not the least stroke of a pen, will by any means disappear from the Law until everything is accomplished. Therefore anyone who sets aside one of the least of these commands and teaches others accordingly will be called least in the kingdom of heaven, but whoever practices and teaches these commands will be called great in the kingdom of heaven.

this passage would disagree with you.. Then again there's so many contradictions in the bible, arguing anything in it is almost pointless."
132,"Biblical scholars would laugh at you. As an atheist, I suggest spending time far away from /r/atheism because it's a cancerous board. We are atheist solely because of a lack of evidence."
133,"As an atheist? Maybe you should start off by saying ""as a condescending douchebag"". You sound like a liberal on his high horse as if he were trying to debate a conservative on politics. 

No shit we're atheists because there's no logical reason to believe in any God. Instead of trying to put yourself on a higher tier of intelligence, bring the scripture of why I'm wrong and be a little more constructive instead of a being a prick"
134,https://youtu.be/4Ru8DMW-grY
135,"You seem to be lost.


"
136,I agree. Subtle humor seems to be lost.
137,"OP: 

#REEEEEEEEEEEEEEEEEE FUCK TRUMP WHY IS HE WINNING

hha I'll make a new account and post this picture thatll show him"
138,"These are the fagget shills we get for opening our borders to BernieBots? Not worth it

#OUT OUT OUT"
139,"**AND STAY OUT!**

That's **13342** deported! ...and they said it couldn't be done.

Got to start somewhere! That's 17.55526% of the estimated 76,000 illegals in Wisconsin!

*I'm a new bot. [suggestions or comments?](https://docs.google.com/forms/d/1w-sXnTQ9bIT3fCbDONoM5TqoTpLxixWuaXSErgPElGg/viewform)*"
140,"Love the intro, this guy must be a real super genius. "
141,Wow. Now that I know they are fake I can never vote for trump.
142,That's its I'm voting Green Party. Thanks I'm off the train. Queer
143,"Excellent work finding Gloria Steinem is on the same server and IP address as Diamond and Silk.
"
144,"""I want to remind everyone here""

That you're banned"
145,[deleted]
146,Here not hear
147,Hillary Shill.
148,to not too...
149,"i think you missed something, friend "
150,"Political polls more than two months away from the election cycle are worthless. Pro or negative don't trust these polls. Also, don't trust Fox. They are not our friends. "
151,We don't need *every* state.
152,I'm sorry. Who is this again?
153,"What are John Oliver's thoughts, or Jon Stewart's?

Comedians are high on my list too for political insight."
154,No alcohol for a reason so you don't turn out like this shithead
155,"*Rolls eyes hard*

This guy is just sprouting out platitudes he's accusing Trump of.

Not only that, but people don't call Trump a ""straight talker"" because his policies, but because of his recognition of the ACTUAL PROBLEMS our country, no, our world is having. 

And it's ironic that the left call us dumb when their solution to our issues is to elect Hillary Clinton, a person who fomented terror in the Middle East, who is in favor of self-destructive trade deals, who is evidently and clearly criminal, who has a timeline in corruption as long as this guy's forehead, and is clearly favored by the people we know is making our world much much worse. 

On top of that, the left is far more concerned with sparing people's feelings and preaching hypocritical odes to ""love"" all the while setting loose upon the world ideological war dogs who take advantage of such naive thinking; committing heinous acts in the name of both Allah and Progressive ideas.

Even if you don't like Trump, how the hell is it smart to vote for someone who is part and parcel of the problem were're going against? How are YOU people not the dumb ones?
"
156,Politics aside his newest Netflix special is fantastic.
157,"Another Leftist tard without a point. GET EM OUT, GET EM OUT!"
158,"**The wall keeps getting taller, good luck getting back in!**

That's **8767** deported! ...and they said it couldn't be done.

Got to start somewhere! That's 7.36723% of the estimated 119,000 illegals in Tennessee!

*I'm a new bot. [suggestions or comments?](https://docs.google.com/forms/d/1w-sXnTQ9bIT3fCbDONoM5TqoTpLxixWuaXSErgPElGg/viewform)*"
159,He looks like he is going to break soon....
160,"People started showing up and asking ""What happened to this sub""."
161,Create some = more memes
162,We had more ammo via the primaries. Now were left with $hillbot. Also... were not even past the convention... why waste all the good and fresh stuff now when it will be more useful closer the the GE.
163,Well Trump just tweeted a meme from here so I'd say it's still pretty dank. 
164,We need more contributors. Also we've spread to other platforms too. The most active of us are transcending Reddit
165,more focus on the election and exposing hillary
166,"Trump policy wise supports leaving it to the states, which is what he said before."
167,He didn't personally say that he supports the law. He supports the guy that  is trying to put the law into place which is just him trying to be friendly with other Republicans.
168,"Typical libs, they can't understand plain text in an amendment but somehow find baby killing and gay marriage In there

 (note I am pragmatically pro abortion and don't care about gay marriage but these should be states issue not fed)"
169,"Exactly, respecting the Tenth Amendment and taking the position, ""this is not a federal matter"" is a perfectly reasonable and Constitutionally sound position."
170,deleted  ^^^^^^^^^^^^^^^^0.3579  [^^^What ^^^is ^^^this?](https://pastebin.com/FcrFs94k/23443)
171,wat
172,No one is immune to criticism. 
173,"Never. 

What voter bloc does Newt bring in?

What swing state or even a blue state will Newt help us win?

What experience does Newt bring in that another candidate could not?

How does Newt fit in with Trump's agenda or at least half his views?

Any other candidate could do a lot more for us in those areas."
174,Newt is full of baggage. Rand or Jeff please.
175,"I'm convinced the VP is someone who no one has mentioned in the press.  If the name has been mentioned in the press, he's probably not the pick.  Trump is that unpredictable.  "
176,"Newt sucks. The media already has all their anti-Newt talking points they just have to dust off from 20 years ago.

https://en.wikipedia.org/wiki/Newt_Gingritch#Marriages_and_children

'Newt left his wife when she was in the hospital after having an affair.'

'Newt had an affair on his second wife, before leaving her and marrying the woman he was having the affair with.'

Think women will like hearing about that over and over and over?

Can't you just wait for some journalist to quip 'The only thing Gingrich and Trump have in common is they have affairs on their wives.' or some other dumb comment?"
177,"Damn it all.  He would be a good pick

What do you have against him?"
178,"

What voter bloc does Newt bring in? Standard conservative 

What state swing state or even a blue state will Newt help us win? Trump will dominate key swing states regardless

What experience does Newt bring in that another candidate could not? are you kidding me? You are a white male.  You know was speaker of the house and balanced the fucking budget.  The man would destroy in the debates.  He is wise, experienced and knowledgeable.

How does Newt fit in with Trump's agenda or at least half his views? That will take more time to answer than it is worth.  They don't see eye to eye 100%, no one ever does.

My turn.

Are you going to keep talking shit if he is the vp?"
179,"What kind of baggage?  

 

"
180,I'm hoping this too.   He needs to pick a general or a wildcard.  Not a fucking political hack.
181,Thanks for the dialogue.  
182,"Skew is right.  Trump has much better options on the table, and already turned down [$200M+](http://www.infowars.com/report-trump-refused-200-million-to-pick-gingrich-as-vp/) to take Gingrich as VP.  If he takes an establishment dark horse, he risks ending up like Reagan 7 months into his presidency."
183,"Nevermind that Newt helped get Nafta passed, he is a known attendee of Bohemian Grove so we know hes an establishment insider. You must be cautios about Trump getting assassinated as TPTB tried with Hinckley shooting Reagan.

If Newt is VP, its not the end all be all. But the only purpose he would serve is for Trump to butter him up so establishment figures allow him to do as he sees fit."
