,0
1551,"'Climate Change' is an unfortunate name.  The Earth's climate has always and will always change, so no one can deny that the climate changes.

The questions are whether how much of an impact is human activity having on the climate, and what sort of negative impacts can we expect from the changing climate over the next 50 years.  We don't know enough to answer either of those questions with any certainty."
1552,/r/askthe_donald
1553,"The free, unregulated market would be better equipped than the government to deal with climate change, man made or not.

Natural gas is a resource. Solar power is a technology. The technology for solar power is advancing at an unprecedented rate. Once the technology becomes so advanced that it is as or more efficient than natural gas, big oil with die off and climate change will no longer be an issue. 

Technology can better flourish in a unregulated market."
1554, Evidence shows that when humans industrialized the earth started heating up 
1555, Evidence shows that when humans industrialized the earth started heating up 
1556,"Evidence!? Compared to what!? Documented Climate patterns only began recording.... Never fucking mind, this is such a waste of time"
1557,"I've been shitposting for a while and this might be my favorite comment.

That moment you finally realize that the left is completely insane."
1558,Go back to Univision
1559,The amount of winning Trump is doing is absolutely retarded. Stay triggered bro.
1560,I love the way he talks. it's unique. You better better get used to it too because he's gonna be your president for the next 8 years. 
1561,"> “Well also Jan. Jan Brewer has been fantastic,” Trump said. “She has been so fantastic. You know I won so big, her territory, and we won so big. And she is a fabulous woman. And I agree with you, the governor of Oklahoma – fabulous person.”
Seriously.. is he retarded? He seems so inarticulate because he can barely formulate a proper sentence. He literally speaks like a fucking 10 year old. Hell, I know 10 year old kids and even they speak better than this retard.

Thanks for your minute of fame. Bye."
1562,"We suspect your post is a troll post. Your post has been removed.

*I am a bot, and this action was performed automatically. Please [contact the moderators of this subreddit](/message/compose/?to=/r/The_Donald) if you have any questions or concerns.*"
1563,You write as if you have a touch of the Down's yourself.
1564,"If you have an actual question about Trump's speaking style(which you don't, you bored troll) /r/AskTrumpSupporters"
1565,Politicians who speak like Rand Paul just bore people.
1566,[deleted]
1567,"If you guys are wondering what all those sweet deleted posts are, check /u/Nebuchadnzr"
1568,I hope you realize he's got to dumb it down for the masses. Hes actually really intelligent.
1569,[removed]
1570,[removed]
1571,[removed]
1572,It appears that he's just a Reddit keyboard warrior who's itching to fight us big bad Trumpkins.  This is hilarious.
1573,[removed]
1574,ok
1575,How many children talk about the governor of Oklahoma? 
1576,"*yeah, he's been able to run a fucking mega business for the last few decades but since he talks in a simple way he must be an idiot and also is incapable of being a good leader*

Yeah ok, great logic there. Come back when you have an actual issue. Oh wait nevermind, since you've been banned you wont be back. Oh well. "
1577,"> You can speak like an educated person without boring people, though. See: Ronald Reagan or Bill Clinton or literally any president not named George Bush. Speaking like a retard is only entertaining to well.. retards. 

Reagan and Clinton were extremely well rehearsed. One of the appeals of Trump is that he is not."
1578,[removed]
1579,"Not sure if you are trolling, [but maybe you need to see something other than the cartoon network](https://youtu.be/Rksd80-FCAw)."
1580,[removed]
1581,[removed]
1582,Nah I've been pretty pleasant to you.  Not sure why you're being all snarky here.  I'm a nice guy.
1583,[removed]
1584,sure
1585,"> Well maybe he needs to rehearse more. The Presidency is not a reality TV show. 

People have listened to ""Presidential"" policy talk for decades now and nothing ever gets done. It's refreshing to see a guy for once who just says what he thinks. People are tired of politicians promising a bunch of shit and never getting it done."
1586,"U/nebuchadnzr says:  
  
>He needs to take the Obama route and carry a teleprompter wherever he goes. He just can't speak eloquently without a script. He'll be a joke of a President just based on his potential Presidential speeches alone. God. What a fucking nightmare!  
  
You are a troll. You didn't even bother looking at my link and instead, you vomit complete garbage and make yourself look real stupid. Did you know his IQ is that of a genious? But how would you know, considering you're still a pre-pubescent anchovie."
1587,"We suspect your post is a troll post. Your post has been removed.

*I am a bot, and this action was performed automatically. Please [contact the moderators of this subreddit](/message/compose/?to=/r/The_Donald) if you have any questions or concerns.*"
1588,"Another attention-starved kid, probably on medications and raised by a single mom."
1589,[removed]
1590,"Your comment has been automatically removed because you linked outside of the Trumpire (see the related subreddits in the sidebar).

Please do not link to non-Trumpire subreddits. ***If you want to showcase a post somewhere else on reddit***, please take a screen cap and black out usernames.

This rule exists to prevent accusations of [brigading](http://archive.is/i4Col) which can get this subreddit banned by the admins of reddit.


*I am a bot, and this action was performed automatically. Please [contact the moderators of this subreddit](/message/compose/?to=/r/The_Donald) if you have any questions or concerns.*"
1591,"So they are bypassing congress all together. They should be arrested if  allow the transition to go through

Edit: is this thread locked from up voting? It's not keeping my vote"
1592,it means we're fucked. Our internet security along with censorship is being controlled by foreign entities.
1593,"As usual,  Obama attempting to hand control of things over to international or multinational entities.   TPP,  UN pledges,  now this bullshit.   Impeach."
1594,Obama is a cancer upon this REPUBLIC. 
1595,"Yes I'm sure it has nothing to do with not wanting world war three, it was Manafort."
1596,Clinton herself helped Saudi Arabian govt influence US policy. 
1597,Clinton 🔫
1598,Upvote if you're voting for Pepe the extinct meme. 
1599,👌😂
1600,"MODS! Lol dude you get fucked, have anything better to do? Your all worked up about about trump, well we will see you in November. Enjoy being a child who can't accept others have different opinions, you brainwashed sheep."
1601,You seem a bit unhinged. 
1602,"Shadowblocking and Shadowbanning are a real threat to ""percieved Free Speech"" in Twitter feeds.
https://twitter.com/search?q=%23shadowbanned%20notalemming&src=typd"
1603,"Californians! Register to vote now. It takes only a few minutes. Remember to register as REPUBLICAN!
https://covr.sos.ca.gov/?language=en-US

*I am a bot, and this action was performed automatically. Please [contact the moderators of this subreddit](/message/compose/?to=/r/The_Donald) if you have any questions or concerns.*"
1604,"Fuck no.  The fix has been in for years now.  
Shrillery will be the nominee.  
Don't get blindsided by this bullshit, centipedes!  
Stay strong!  Trump 2016!"
1605,"Wouldn't hurt.

If Bernie is far behind, you could vote Bernie to sow dissension.

If Bernie catches up, you could always vote Hillary to make sure she is the nominee to face Trump."
1606,"No fucking way, dude. That's some lyin' Ted level bullshit."
1607,"We want Hillary to fight against, not the Bern."
1608,"You really are a negative person.  You won't get far in life with an attitude like that.  Seriously.

So you think Donald Trump has ever given up on anything?  No.  He is the most positive person I have ever seen!  And look at him!  Look how far it has gotten him in life!  He is a Billionaire!

How about you?  Not with that negative attitude.

I am like Trump.  I don't give up.  I stay positive.

TRUMP WILL WIN!!!

Seriously, change our attitude if you want to make it far in life."
1609,Yes. Yes he will.  It will surprise some people.
1610,"Yes he will win in November!

This train has No brakes!

"
1611,What a stupid fucking question. Of course he'll win. 
1612,[deleted]
1613,[deleted]
1614,"#[IT'S OFFICIAL! DONALD J. TRUMP IS THE REPUBLICAN PARTY'S NOMINEE FOR PRESIDENT! THE TRUMP TRAIN JUST GOT 100,000 MPH FASTER!](https://www.youtube.com/watch?v=hgM2xN5TPgw#322017000)

#CURRENT SPEED: 322,017,000 MPH!

That's 48.01805% of the speed of light (670,616,630 MPH)! Only 348,599,630 MPH left to go!

^^^^A ^^^^bot ^^^^by ^^^^/u/BotsByLiam. ^^^^Please [^^^^use ^^^^this ^^^^form](https://docs.google.com/forms/d/1HdOFBQ85C6qHKS8YdG0le6UiffBfj5saBM6qTp3ZAvQ/viewform#responses) ^^^^or ^^^^visit ^^^^/r/BotsByLiam ^^^^to ^^^^report ^^^^errors ^^^^or ^^^^make ^^^^suggestions!"
1615,[deleted]
1616,"If you can't handle the heat, get out of the kitchen.  Seriously."
1617,I think it will come down to how much voter fraud there is. 
1618,We don't need your negative energy.  Seriously.
1619,[deleted]
1620,"Wow, nice language."
1621,"I disagree. The issue is not hatred of men, but the knowledge that there are more perverts than there are transgenders, who are like.. what? 0.3% of the population?

Shit, that number is so low I'd be willing to believe that there are more women pedos who'd touch little boys in the men's bathroom than that."
1622,"It is not a safe space, it is the front line of the meme war."
1623,#OUT! OUT! OUT
1624,"Also, OP's username checks out "
1625,"We suspect your post is a troll post. Your post has been removed.

*I am a bot, and this action was performed automatically. Please [contact the moderators of this subreddit](/message/compose/?to=/r/The_Donald) if you have any questions or concerns.*"
1626,"Interesting how the poll they're reporting on was conducted by Rock The Vote, which is an organization that is directly funded by Soros' and Open Society.

So, in the end, another cooked/oversampled poll."
1627,"If they were behind the fence at the DNC, they have to be idiots.

TL;DR

""Clinton is a victim of sexism""

""Trump voters are bigots""

""The RNC was a disaster""

All lies."
1628,"literally every controversy since the muslim dad attacked him has been spun or has been outright lies in some cases.  it will continue til the election, the media doesn't even care anymore, some jackass wrote an article last week saying it was ok to report biasedly on trump because he is so dangerous

trump said that barry and hillary were the founders and mvps of isis last week and every channel had experts coming in for days to tell us that they were not really the founders of isis"
1629,"He keeps shooting himself in the foot.  ""Obama founded ISIS, i'm super cereal"", then the next day he's like ""I was being sarcastic?""...Like wrf Trump?  Why doesn't he just stfu and let the newly released emails make it through the media"
1630,"Then smite me whetto.

"
1631,"Idiot? Not that I'm aware of. Would've been nice if you actually gave us some context here. What, of his doing, are you referencing?"
1632,He should have just ignored the Khans.  He fell for the trap.
1633,"The Khan shit (which I don't blame him for) the.....fuck man just take a look at /r/ctr / /r/politics.

"
1634,That's my point. He's giving them fuel. Fuck man. He knows their games. So why is he playing into them?
1635,I don't give either of those subs traffic.  Did he offend Khan again or something?
1636,"No it's just that the media is giving him a continual platform, and liberals are eating it up. "
1637,GOP insiders: Jeb's penis still tastes like guacamole
1638,Trump has been doubted and second guessed at every step every word analysed and every possible slight or offense taken. Hillary clinton wallowing in corruption parkinsons and false you go girl bullshit has been nothing but fellated the entire time. Yet trump is still in this fight. There are no brakes on the trump train.
1639,[deleted]
1640,"#[IT'S OFFICIAL! DONALD J. TRUMP IS THE REPUBLICAN PARTY'S NOMINEE FOR PRESIDENT! THE TRUMP TRAIN JUST GOT 100,000 MPH FASTER!](https://www.youtube.com/watch?v=hgM2xN5TPgw#314817000)

#CURRENT SPEED: 314,817,000 MPH!

That's 46.94441% of the speed of light (670,616,630 MPH)! Only 355,799,630 MPH left to go!

^^^^A ^^^^bot ^^^^by ^^^^/u/BotsByLiam. ^^^^Please [^^^^use ^^^^this ^^^^form](https://docs.google.com/forms/d/1HdOFBQ85C6qHKS8YdG0le6UiffBfj5saBM6qTp3ZAvQ/viewform#responses) ^^^^or ^^^^visit ^^^^/r/BotsByLiam ^^^^to ^^^^report ^^^^errors ^^^^or ^^^^make ^^^^suggestions!"
1641,Because some deluded Republicans still have wet dreams about a Bush dynasty
1642,No. 
1643,#NO BAN 
1644,10 FEET HIGHER
1645,"#We're going to have a big beautiful door in the middle! 

[Trump's wall just got 10 feet higher! *High Energy*](https://www.youtube.com/watch?v=qlIGom24qqc) 

#Total height: 59930ft. 

We are 92.2% of the distance     of the Hot air balloon altitude record (65000ft)! 5070ft remaining. 

***** 

Bot by /u\/TonySesek556 - [About Page](https://aws.wariomissed.com/TheWallGrows/) - **[TAKING SUGGESTIONS](https://docs.google.com/forms/d/1nbT77UN01wxB3OPVWC8LlesD1e8jqj5mnkhItd4qQqk/viewform)**"
1646,"no, it's not satire, shill. Nothing he has said is ""stupid, or things third graders think is stupid"" go back to your cuckshed, AKA ""Correct the Record"". The only thing ""satire"" is Hillary's campaign"
1647,Don't let your memes be dreams.
1648,"We suspect your post is a troll post. Your post has been removed.

*I am a bot, and this action was performed automatically. Please [contact the moderators of this subreddit](/message/compose/?to=/r/The_Donald) if you have any questions or concerns.*"
1649,"I have a PhD in math and support Trump. I listened to Trump's speeches, didn't sound dumb to me at all.

Stop listening to the media."
1650,"Let me rephrase your question. ""Wow, are you people really much smarter than the average Democrat in that you can actually see how the media manipulates one's words to mean something different? Awesome."
1651,Nah roger is great and very smart knows what he's doing! Wish he still was at fox 
1652,"My personal view is that Donald does best in the debates when the heat is on him. He attacks viciously and gets pumped with adrenaline, which makes him quick and witty. 

I hope he isn't ""Coached"" out of his instincts by professionals. I like it raw, even if he ends up looking uninformed sometimes."
1653,"I'm sure he is great, but I am also sure he would have advised Trump to not turn the audience, the debate moderators and all opponents against him in that memorable 9/11 - Iraq War debate moment with CBS. That was Don at his best."
1654,Shitpost?
1655,"WTF is this?  

Did someone forget to take the meds?"
1656,[deleted]
1657,A shitpost is welcome.  A shitty shitpost is not.
1658,LOL look at how uncomfortable Will Smith is meeting Trump
1659,"Fuck this headline.

Bison and their return is a God damned American success story"
1660,Lmao at least he picked a badass animal
1661,"Sanders is fucking useless. If his supporters can't get free CHOLLEGE they won't vote for him, and they wouldn't if he were VP

I do agree with you in theory. I just couldn't see it happening."
1662,"Fuck no, get that wrinkled socialist hack OUT"
1663,"Sorry, but a Trump/Sanders ticket would be a horrible idea. Do you remember what happened last time someone tried to combine Nationalism and Socialism?"
1664,That would be retarded. A capitalist with a socialists VP. Sanders can go eat a basket of dicks after he loses to Hillary
1665,This post has been removed because it violates RULES 6 and 8
1666,It is rumored that she now where's adult diapers. 
1667,after i got my second business degree
1668,Never. 
1669,Already deported. Our mods are fast.
1670,"We suspect your post is a troll post. Your post has been removed.

*I am a bot, and this action was performed automatically. Please [contact the moderators of this subreddit](/message/compose/?to=/r/The_Donald) if you have any questions or concerns.*"
1671,"Ahem I think I speak for all of us when I say.

Wat?"
1672,deleted  ^^^^^^^^^^^^^^^^0.0826  [^^^What ^^^is ^^^this?](https://pastebin.com/FcrFs94k/71299)
1673,[deleted]
1674,"His methods to bring jobs back to America make perfect sense.

If a company sells say, 80% of all of its products to USA, slapping a huge tariff on them to import to USA is actually going to cost them more money than they would save by moving offshore and they cant just decide not to export to USA, they lose most of their profits.

The downside, yeah the company would be forced to cut jobs overall but its better than having 0 in USA and profits going overseas.

I live in Australia and even that is blatantly obvious to me."
1675,"Nationalist candidate, moderate to lax on social issues while showing  backbone to other countries across the globe. Addresses common-sense issues that have plagued the country, trade-deals, illegal (emphasis on illegal) immigration, U.S. being policeman of the world and other nations taking advantage of our huge security spending. Stopping drugs coming into the country and actually doing something on the supposed ""war on drugs"" that we've been in forever with the Wall is a big plus. 

He also says whats on his mind, rather than what his advisors want him to say, and I think that is an important quality to show trustworthiness in a person. Being candid about his thoughts, even if it isn't the ""right"" thing to say."
1676,[deleted]
1677,Because he's the most successful of the other 2 candidates and his business savvy background proves that his talk about creating jobs isn't hot air. A guy that built a multi billion dollar empire knows a thing or two about managing and where to invest resources. 
1678,German here. I support Trump because he will make immigration easier for white Europeans.
1679,"Strong immigration policy
Taking politics back from the grip of the media [like for instance the owner of amazon buying up newspapers so he can spread favorable publicity about putting companies out of business while he dodges taxes]

But I think the most important thing is Trump's attitude. People don't like his hair, his self promotion, the fact that he is successful. Fuck them. Those are not real issues or reasons to dislike anybody. SJWs are trying to take over the country and make everyone's life miserable and unlivable, because that's what chronically depressed and psychologically deranged people do. Trump is strong enough to stand up to people like this, and lead others to do the same. We're not just making america great again, we're making it normal, for people who like to enjoy life and have fun

Trump is extremely articulate and well put together. His congressional testimony about the UN renovations for example. He's had some very interesting ideas about tax policy, years ago he suggested a one time tax to pay off the national debt. I believe he is looking out for the interests of the country, not selling the country out.

check out /r/asktrumpsupporters though like others have suggested"
1680,OUT OUT OUT
1681,"Why are you opposed to the Transpacific partnership if I might ask?

I can see illegal immigration being an issue but has he actually given specifics on how he plans to do so?"
1682,"This is a very good answer, thank you."
1683,I... don't know if you're being serious with a name like that xD.
1684,"True, but managing a business is very different from a country, the mechanics are not the same, you must work with the resources you have rather than being able to acquire new personnel/resources and you have tons of legislation to go through for American policies especially I would imagine, wouldn't political experience be more necessary to deal with that rather than business savvy?"
1685,Yes he has countless times. Tariffs.
1686,"First off its a free trade zone. All of Canada/US manufacturing will go to places that have 1.50$ minimum wage. TPP allows companies to sue governments for ""Infringing upon their investments"". If a Mexican company came to the US, and we passed some sort of regulation that decreased their sales, they would be allowed to sue the US, IN A MEXICAN COURT. The idea is utter insanity. "
1687,You should post in /r/AskTrumpSupporters. That's the normal sub for discussion with non supporters.
1688,"So not for any xenophobic reasons but more towards the concern raised in other countries in which large corporations gain more power, I see, thank you."
1689,"Hardly, come in legally with a skill set and that's great. We spend 130 billion a year on Illegal immigrants, so a ten billion wall makes a whole lot of sense. Every bit helps the debt"
1690,Still not uncucked. You must disavow and fill the congress and governor seats with Trump supporters to _MAGA_
1691,"This isn't #neverhillary

Time to release yourself from his cucky chains"
1692,**TAKE HIS COAT**
1693,"God speed, OP. "
1694,[removed]
1695,THEN FUCK OFF
1696,[deleted]
1697,Go back to your socialist shit hole you commie bastard.
1698,"We suspect your post is a troll post. Your post has been removed.

*I am a bot, and this action was performed automatically. Please [contact the moderators of this subreddit](/message/compose/?to=/r/The_Donald) if you have any questions or concerns.*"
1699,"https://i.sli.mg/T4NolR.jpg

We're not stooping to their level until we start supporting a batshit crazy 74 year old Leninist."
1700,[removed]
1701,What happened? 
1702,[deleted]
1703,"More evil ... The shills keep downvoting this, please help us spread the word !

And please help us to get the mods to take notice and get this stickied!

[CAJUN NAVY-CENTIPEDE AUXILIARY to the rescue: Here's how we can help, when Obama and Hillary won't](https://www.reddit.com/r/The_Donald/comments/4yk48j/cajun_navycentipede_auxiliary_to_the_rescue_heres/)


"
1704,"Super butthurt behavior, probably as much as Hillary's butt on that stool."
1705,[deleted]
1706,http://archive.is/9BhSI
1707,http://archive.is/9BhSI
1708,"**Another one bites the dust!**

That's **65500** deported! ...and they said it couldn't be done.

Got to start somewhere! That's 35.40541% of the estimated 185,000 illegals in Massachusetts!

*I'm a new bot. [suggestions or comments?](https://docs.google.com/forms/d/1w-sXnTQ9bIT3fCbDONoM5TqoTpLxixWuaXSErgPElGg/viewform)*"
1709,I concur
1710,Trump's former Employee was a real joy as well.   Back-stab much?
1711,"Sorry cuckie cheese pizza, try again"
1712,"We suspect your post is a troll post. Your post has been removed.

*I am a bot, and this action was performed automatically. Please [contact the moderators of this subreddit](/message/compose/?to=/r/The_Donald) if you have any questions or concerns.*"
1713,reported
1714,"As a Trump supporter, I sort of see where you are going with this. I can agree that another Clinton in the WH would be a disaster, but I don't think that you will ever see a Trump/Sanders ticket for 2 main reasons:

1. Trump and Sanders, on most issues, are polar opposites. Although there may be some common ground, it's way too little for them to work together.
2. The protests. When you have people showing up at Trump events wearing Bernie gear, or claiming in the media to be Bernie supporters, and doing things like burning flags, assaulting Trump supporters, committing vandalism, calling Trump a ""Nazi"", etc. that kinda blew it for you guys. Trump supporters would NEVER stand for a combined Trump/Sanders ticket at this point, and I'm sure Trump knows that.

If you want to join us, and vote for Trump, that's great, and would be appreciated. However, you need to disavow Bernie. There are no half steps. You guys already screwed the pooch on that one."
1715,"[Streamable mirror](https://streamable.com/yovq)   
___   
   
I'm a bot.   
If you have any suggestions you can message my creator here: [PM](https://www.reddit.com/message/compose?to=eRodY&subject=[TwitterToStreamable]%20-%20)"
1716,[deleted]
1717,Yep. Far from Aryan.
1718,"Misleading title, pets can't vote. Easily bribed with treats."
1719,"This just in: Trump buys votes! With begging strips. Also Hillary can't buy votes, dogs won't even try the peanut butter. -CNN"
1720,#Arf Arf Arf
1721,Yikes 
1722,sad...
1723,Wow fantastic contribution here. I think we are all better off from your having posted.
1724,I think we should print it out. You know post them is places like philly. Share it on Twitter 
1725,[deleted]
1726,"Uh, it was only posted to mock people who call Trump racist. I don't really see how this is racist at all, but alright."
1727,"Jeb didn't kill him because he was black, Jebbers killed him because he was pointing a gun with intent to shoot The Don. It's not racist. Fuck Cuck Mods."
1728,You're joking? I say some pretty borderline racist things. But I've never said anything like this. Make America white again? Trump would disavow you if he heard you say that. 
1729,"Lol I'm honestly pretty fucking borderline racist most of the time and even I wouldn't post this. This has nothing to do with cuck mods. It's just genuinely racist. It says ""'make America white again"", which I'm sure Trump would fucking hate to hear. And also says ""all blacks are criminals and violent"""
