Unnamed: 0,0
1393,think politician trump need stop cancelling delaying plan due terrorist attack foreign groundsthat disruption exactly give attacker power need strong determined leader back best way showing continue plannedagain attack trump think gop democratic candidate would probably atm 
1394,thing stop bad guy truck good guy truck 
1395,youve watched medium outlet saying classy matter look respect victim 
1396,going penny time float story switch week ago going newt 
1397,dont understand penny could save face either take big political risk potentially blow trump story dropping governor race dump trump awkwardly whether really happened isnt yet known perhaps trump indecisive simply hoping continue build suspense announcement whatever truth appearance worked thursday 
1398,he respect victim family 
1399,lol wut 
1400,guess penny 
1401,get dont mean criticismhowever think disrupting schedule delaying event give attacker much power imo 
1402,he know vp announcement would get buried news today 
1403,penny trump never verified 
1404,nothing trump ever get buried news cycle would announcing friday news go die 
1405,today trump verified 
1406,he good getting medias attention part know change story certainly wouldnt trump today isnt want making biggest announcement campaign trump took time last tragedy gloat dont think silence today care victim politics 
1407,give example could falsify claim 
1408,dident rasmussen predict mitt romney landslide 
1409,doubt validity rasmussen poll dont think clinton supporter dismiss finding clearly shift towards trump past week likely continue gop conventionhowever clinton detractor shift led insurmountable lead trump much depends happens personal opinion clinton probably weathered worst bar new information 
1410,via rasmussen strong republican lead via better pollster new nbcwsjmarist poll co clinton trump fl clinton trump nc clinton trump va clinton trump july 
1411,rasmussen batshit collection method 
1412,haha riight 
1413,let guess without clicking link rasmussen 
1414,thats quite large lead 
1415,
1416,even worse mitt drank koolaid great doc followed campaign convinced would win didnt even consession speech written major poll outside rasmussen election going obama 
1417,deleted 
1418,romney point 
1419,stop meme romney 
1420,dont think anyone dismissing poll especially one several thats moved towards trump people aware last poll postfbi statement prebernie endorsement prevp announcement preconventions headed bumpy polling ride next week anything snapshot best 
1421,biggest issue today july election little le month away much change american politics time period stupid comment trump another clinton scandal popular rd party candidate 
1422,clearly shift towards trump past week likely continue gop conventionactually untrue there shift away clinton stein johnson trump barely gained voter even clinton pummeled press last week good clinton favorables trustworthiness number tank favorable trump really benefit itll easier clinton pry voter back third party candidate theyd gone major candidate 
1423,clearly shift towards trump past week likely continue gop conventionnot look nbcmarist poll came today show trump lot key swing statesthe average shifted slightly trump favor give early trump fan get excited he still losing worse romney 
1424,qunnipiac hasfl trump clinton oh trump clinton pa trump clinton 
1425,im nc hate tell hrc hold state 
1426,deleted 
1427,would leave gary johnson jill stein shes ballot state considered accurate anyway 
1428,rasmussen polling people republican make feel better 
1429,solution trust poll dozen show trump ahead 
1430,would gotten away werent meddling kid 
1431,proud day michigander shut state went bernie 
1432,nah httpmrasmussenreportscompubliccontentpoliticalcommentarycommentarybymichaelbaronegoingoutonalimbromneybeatsobamahandilybottom line romney obama sound high romney could drop pennsylvania wisconsin still win election 
1433,stop meme romney much incorrect erred side gop candidate point 
1434,mostly agree would imagine hillary probably experienced worst polling month bar new informationscandals get better 
1435,theyre basically tied lowtomid american 
1436,also morninghttpwwlatimescompoliticslanapolusclattrackingpollsnapstoryhtml 
1437,look like pretty good average clinton 
1438,ill believe poll anecdote trump polling badly nc growing latino population state likely sink 
1439,presidency decided national popular vote 
1440,one even remotely anymore httpwwlatimescompoliticslanapolusclattrackingpollsnapstoryhtml 
1441,view expressed column author rasmussen report 
1442,probably realistic anything clinton slight leadrassmussen bullshit might well completely disregard pollsif trump good convention name good vp start creep pollshe need avoid blunder going forward thoughthings seem going better since fired corey l 
1443,picked romney obamas nd term state going red like trump heed north carolinian opinion dont forget need id vote nc httpwwrealclearpoliticscomepollspresidentncnorthcarolinatrumpvsclintonhtmlpolls 
1444,shes already basically caught poll margin 
1445,rcp average linked show clinton ahead nc agree probably one closest state evidence suggests shes going win trump ground game pathetic thats kind thing throw together couple month 
1446,umm poll released couple hour ago preceding uscla time poll date march wasnt general election poll 
1447,think spent much mil raised campaigning shall see 
1448,umm nohttpiimgurcompyllnpng 
1449,sure able spend ad sort thing point thing take long time good turnout operation take month month build barely ground swing state thus far operation surely better election day clinton likely outclass regard alone tilt close election favor 
1450,usc dornsifes website last press release polling site march cant seem find la time website 
1451,trump nc raleigh day clinton someone tell phone would vote clinton doesnt mean theyre going booth 
1452,dude link postedhttpwwlatimescompoliticslanapolusclattrackingpollsnapstoryhtml 
1453,true poll arent perfect indicator thing due far superior ground game tie go clinton demographic nc shifting dems favor 
1454,haha scripting turned browser completely didnt show visited pagesheepish redditor feel sheepish 
1455,private citizen violate first amendment 
1456,surely part federal government violate st amendmenthis policy proposal point word actually violate st amendment undertaken 
1457,yell fire movie theater 
1458,ironically enough exactly kind speech first amendment protects 
1459,isnt violating first amendment 
1460,trump supporter bash trying call bullshit talking first amendment trump say something stupid someone come call uneducated trump supporter meanwhile educated one shake head disappointment yell telling need silence trump expressing first amendment right 
1461,ironic thing banning fracking wouldnt good environment fracking allowed natural gas supplant coal united state huge net positive natural gas half emission coal burned coal le natural gas would adding ghgs atmosphere 
1462,thats got ta stupidest reasoning supporting fracking completely missing whole point 
1463,ironic thing banning fracking wouldnt good environmentironic untrue reality reduction greenhouse gas marginal consider methane released extraction process pollution due fracking chemical currently well understood renewable energy much cleaner safer soon cheaper alternative 
1464,isnt point banning fracking improve environment 
1465,well ban fracking electric power replacement renewable energy coal think thats obvious cant build new renewable energy capacity overnight burn coal coal mining also even worse environment fracking pollution extraction great shake eitheras methane come ghgs c real problem release c longterm affect methane doesnt stay atmosphere longterm 
1466,thats ridiculously oversimplified wrong fracking extraction method ban doesnt shut existing producing well currently major supply glut coal longer economically feasible even without carbon tax renewables future dont fall political talking point 
1467,coal longer economically feasiblebut coal economically infeasible fracked gas eliminating fracking reduce productivity new well drive supply driving cost improving economics coal 
1468,wind cheaper coal solar include carbon capture contest factor environmental public health cost coal eliminating fracking wont magically erase current supply glut gas 
1469,suppose quoted entire sentence emphasis mine coal longer economically feasible even without carbon tax would anyone include carbon captureand havent even touched capacity wind doesnt provide capacity since isnt dispatched coal destroys wind price add energy storage banning fracking mean helping economics coal 
1470,would obama care fundamentalist republican want 
1471,obama press republican show support office 
1472,concern aint got leg lt dan 
1473,texas get ignorant bigot 
1474,honestly expect obama 
1475,one came baltimore go figure he welcome go back anytime 
1476,thinking texas full ignorant people doesnt make ignorant 
1477,maybe tweet people reap sow like dan patrick orlando shooting 
1478,make want move back pennsylvania 
1479,audacity tell obama choose word carefully reap sew tweet called people hypocrite running away terrorist sniper simply protest police killing anyone need choose word carefully dan patrick 
1480,people would bitch he presidential let throw card table know damn well lose lose obama people piss moan matter position take 
1481,pences claim fame deep hatred lgbt little elseapparently trump felt like needed piss one minority group u made selection 
1482,seems like trump trying solidify support basically already smart trying promote brand idk thats going work get elected though 
1483,alienates lgbt community woman independent big time sure safe pick trump 
1484,case havent made clear 
1485,hi sportsbrawlss thank participating rpolitics however submissionhttpswwredditcomrpoliticscommentsszrailministerresignsassoutherncommuterchaos removed following reason offtopichttpwwredditcomrpoliticswikirulesandregswikithefrfpoliticsontopicstatement submission rpolitics need explicitly current u politics question removal please feel free message moderatorshttpswwredditcommessagecomposetorpoliticssubjectquestion regarding removal submission usportsbrawlssmessagei question regarding removal submissionhttpswwredditcomrpoliticscommentsszrailministerresignsassoutherncommuterchaoscontext 
1486,sooper spky stuff right 
1487,sorry op rpolitics isnt conservative yet give couple month 
1488,public option original design lower cost well guess part obamacare isnt rousing success cost 
1489,caint even drank beer u driving obama 
1490,damn libruls trying gut percent gdp better stay away medicare 
1491,death panel 
1492,look original proposal ended passed congress way figure issue original proposal law passed congress 
1493,might well call queen since nobody elected 
1494,hi jamalkaki thank participating rpolitics however submissionhttpswwredditcomrpoliticscommentsszjcbrexitpmiswillingtolistentooptionson removed following reason offtopichttpwwredditcomrpoliticswikirulesandregswikithefrfpoliticsontopicstatement submission rpolitics need explicitly current u politics question removal please feel free message moderatorshttpswwredditcommessagecomposetorpoliticssubjectquestion regarding removal submission ujamalkakimessagei question regarding removal submissionhttpswwredditcomrpoliticscommentsszjcbrexitpmiswillingtolistentooptionsoncontext 
1495,doesnt executive position contingency plan like u case highest governing seat either killed step also cant call queen already actual queen 
1496,queen one thing 
1497,jim jones natural leader 
1498,doesnt seem unpleasant belief especially antifamily one unpleasant 
1499,extremist politcal view unpleasant 
1500,antifamily 
1501,lgbt family 
1502,thing need happen climate change government stop subsidizing market force already aligned fossil fuel propping fossil fuel causing delay replacement 
1503,nice idea fossil fuel subsidy government outside u 
1504,guess breath air 
1505,support presidential candidate respective party achieved worst unfavorable percentage history polling data 
1506,absolutely true 
1507,yeah delusional 
1508,apparently trump clinton supporter likely average voter like mcdonaldstrump supporter like football basketball clinton supporter like basketball footballalso trump supporter love freedom care family thing important clinton supporter 
1509,
1510,bernie supporter headline make happy everything exactly want exact 
1511,removed 
1512,fast enough 
1513,deleted 
1514,deleted 
1515,welp either going clinton trump president relatively stupid longer easyalso slight bit butthurt muh canidate 
1516,intelligence presidential nominee vp pick 
1517,think intellect potential president fair gameits called palin factor 
1518,tbh gay conservatism really interesting concept sort conservative arguably conservative conservative united state borderline reactionary although gay take would likely le reactionary le likely hold step backwards marriage even accept american conservative also little c conservative definitely conservative within gay context conserving gay social norm would actually pretty intensely radical itd antiassimilationist dunno interesting concept edit got ta drop word concept kek 
1519,old guard eventually keel maybe republicanism finally become party embrace reason 
1520,deleted 
1521,deleted 
1522,libertarian point least wouldnt selfflagellating supporting candidate actively work 
1523,gay republican use push platform change wasnt effective 
1524,deleted 
1525,deleted 
1526,libertarian trump resonates though 
1527,seriously people made fun sander called huge loser actually managed influence dnc platform thats far far gay republican ever managed fuck nowadays republican actively trying take away hardwon right gay people 
1528,deleted 
1529,even conservative still look forward least slightly come certain thing think thats much healthier conservatism american conservatism slightly liberal instead slightly reactionary significantly healthy society im sure stable right america period massive change im sure say nope carefully point think late compromise basically whitepicket fence ideal lifestyle choice everyone gay straightmaybe think whitepicketfence ultimately remain dominant lifestyle choice meaning continue change past 
1530,could great discussion subeh im sure sub capable good discussion highly rated post large frankly think civility rule make place uncivil encourages playing line concern trolling 
1531,deleted 
1532,deleted 
1533,deleted 
1534,think interesting point ever read emile durkheim personally socialist socialist way book described made sound like someone thought world governed sociologist tbh thats understandable sociology baby lot theory interacted need stability well optimism inevitability change basically even though personally pretty far left theory interesting conservative undertonesi think modern conservatism could learn lot tbh everyone could learn something durkheim he favorite theorist especially conservative also interact fact world change degreeand agree point entirely think reality interpret reality entirely whomever chooses assimilate would interpret sense pride personallyi think thats perfectly fair 
1535,deleted 
1536,yes nominate justice oppose gay right people he proposed far abysmal record gay rightsand trump doesnt make rule he bound pesky constitution would need congressional approval 
1537,trump gay right supporternot really vp pick even worsehe make rule he office guiding handthe president doesnt make law assume meant lawshe wont appoint people sc infringe ushe said wouldyoure well informed dildo dildo long playing attacking someone instead message gamewhat rubber fist 
1538,deleted 
1539,deleted 
1540,deleted 
1541,deleted 
1542,deleted 
1543,obama exceeding power shouldnt shamed thatedit also im sure understand executive order 
1544,define rule rule im following meantrump said appoint conservative supreme court justice hand gay marriage back state progress state texas would ban immediately 
1545,deleted 
1546,deleted 
1547,deleted 
1548,hi johnzoidberg thank participating rpolitics however submission removed following reason already submitted article submitted rpolitics within last three day httpreddittlmim bot sometimes make mistake question removal please feel free message moderatorshttpswwredditcommessagecomposetorpoliticssubjectquestion regarding removal submission ujohnzoidbergmessagei question regarding removal submissionhttpswwredditcomrpoliticscommentsthucongressreleasespagesonallegedsaudi 
1549,push 
1550,wrongdoing welcome investigationslets see happens 
1551,house republican aka judical watch lapdog decade pretty cheap member congressi guess small fine worry long get rule changedhttpwwnytimescomuspoliticskochfederalelectioncommissionfineshtmlthe federal election commission fined three nonprofit group formerly connected political network overseen brother charles g koch david h koch according document released liberal watchdog group wednesday rare intervention commission world outside spendingeach group american job security plus association american future fund ran political advertisement support republican house candidate electionmillions dollar worth contribution provided arizonabased organization time central hub financing koch network donor political group fecs investigation provides look although partial dated one interlocking network political nonprofit right vast sum money flow election cycle little disclosure group required disclose donor typically trade large tranche cash election cycle intentionally making difficult even tax election authority judge donor dollar used particular activitya spokesman freedom partner group serf nerve center network said koch organization involved directed particular spending issue fecs investigation 
1552,two political party democratic party antidemocratic party 
1553,youre guilty nothing hidei guess thats snowden meant along right 
1554,one welcome gop wasting money chasing ghost 
1555,wont know ghost unless investigate 
1556,thats good argument trump needing release tax return every candidate decade done yet trump refuse wont know see 
1557,absence evidence need certain ghost invisible duh 
1558,investigating agency irs already 
1559,absolutely nothing fbi investigation charity 
1560,american politics gtfo 
1561,nice work 
1562,removed 
1563,httpsyoutubencbvvu 
1564,republican critical surprise democrat could critical really problem right wrong issue gap finding fbi recommendation fbi needed explainatuonin mind intent needed prove intent control email hilary remove control government system done intentionally consciously placing potentially classified communication substandard private systemtaking personal control classified information criminalbut democrat cant critical gave u candidate first place 
1565,congressional oversight anything longer effective whoever control white house permit doj apparently fbi prosecute friend make doj political appointee aside judicial answer congress game change everything foreseeable future partisan divide people united state continue widen equal thing new civil war 
1566,alberto gonzales also extremely careless classified document democrat dont six hearing wasnt crime 
1567,taking personal control classified information criminalunder statute problem whole episode people keep asserting crime committed spite fact investigatory body access testimonial documentary evidence concluded there basis claimim sure upaulsnow mean say taking personal control imagine youre thinking statutory language related removing information proper placemaybe thats youre saying maybe illustrative point go stopped ask legal basis claim clinton conduct contradicted statutory requirement take granted 
1568,oh great answer obstructionist partisan congress ever nothing could possibly go wrong besides congress doesnt time aca vote benghazi panel theyve got going 
1569,deleted 
1570,stated problem nobody else caught going punish one chance independent committee made people governing body vote appoint would fair unbiased 
1571,bro fbi criminal investigation hillary clinton isnt republican witch hunt case referred fbi inspector general intelligence community year long investigation without political influence either partybringing comey answer question completely justified move due unprecedented nature announcement republican question wellreasoned lead important clarity issue concern american electorate democrat making mockery rambling black life matter gun control zika virus im exactly sure youre referring 
1572,alberto gonzales also extremely careless classified document democrat dont six hearing wasnt crime nowso also set email server used exclusivelybut problem investigating like done many others mishandled classified document 
1573,ok like law break dont know think law book keep people done 
1574,removing classified information proper place others even comey quoted statue let give basisi old top secret clearance made clear u protect classified information well operational information latter case ti treat classified copy aviation week took secured area often clearly discussed spy could possibly glean crease indicating interest article could give many example lowly engineer college clear couldnt handle classified information even hold discussion meta information classified information outside secure facilitiesthat hillary constructed system manage communication anyone might send classified information even operational information exchanged outside approved governmental system matter flaw said system clinton edited p provided constructed version state department demonstrate purposeful intent subvert security accountability state department allowed continue investigated prosecutedwe would fired likely prosecuted leaving printer ribbon printer allowing serviced noncleared holding secret clearance personnel escorted printer used print top secret document even though ribbon loop ribbon cycled reused time obscuring pattern printhillary gave full direct access many uncleared personnel communication device serversthe defense fbi gave hillary neither understood classified information protected cant see around could fail understand classified information managed personal system yet designed implemented persisted even system failed filtered legitimate system 
1575,investigatory body made careful slight hand verbiage call behavior clinton staff anything negligent hammering point didnt intend commit crime specifically duck feveryone intelligence community familiar f great boogeyman mishandling classified information regardless intent fact clinton wasnt charged f showed everyone two track justice system really exist james comey without question anyone familiar statute laid clinton violation f since didnt intend harm national security allegedly one would prosecute itthe problem intent isnt required f negligence evidence abundance relabeled carelessness hearing shocked one asked director comey specifically stopped recommending indictment basis f 
1576,think going get better sadly mistakenthis might obstructionist congress ever bar set going get worse worseif think aca vote havent paying attentionhttpwwusnewscomnewsbusinessarticleshousegoptovotetorepealobamashealthcarelawbetter get used new world order obstructionism new reality something drastic happens nothing going change thatwhat seem face broad support country republican proxy conservativism dont like fucking bad plenty conservative hate progressive apologist either something going give order bring two side together partisan game going get worse thinking conservative going simply get old die thing get better ludicrous people descendant easily forget war rage decade century 
1577,exactly really way equalize problem different faction people nation end people going fight let best one win honestly see either side political spectrum compromising show proof movement see nothing bringing two side together except conflict see u growing apart regardless started reasonable unreasonable shame people submission force shadow waiting chance strike back really think legislate hate racism away legislate thought publicly shaming people effort force social change piss sooner later come blow thats way see itand way retired military survived two war without killing anyone medic saved life ever thought could firearm never also neither democrat republican year old never voted hate system votingcheers 
1578,mean judicial branch 
