Unnamed: 0,0
0,peaceful protest like civil right movement handful protest peaceful cop beating protestors police violence first amendment right isnt peaceful man part movement like black panthersit stated many time part movementstill watching reason also black panther stopped many police shooting around im racistwhoops racism oneway street systemic issue tell something black life matter life matter entirely different thing cop shoot asian lower rate white cop shoot black time shoot white black people likely live poverty x white x likely arrested misdemeanor white man poverty increased black community many area since civil right passed thats another reason life matterblack life matter exists doesnt mention white folk needing equality two century slavery century blacklash slavery fifty year backlash civil right white folk never experienced video ignorant get video smallest part whole picture creator doesnt even know picture creator video scared black people riot four century constant oppression place finally dont look word look whole sentence dont look chapter look whole book mean dont read look cover look whole book without opening whole book rectangle word dont read itthey need facfacfactfacfactordy reason whats factordy mean another reason gun thing tack right end dont want say creator video need help say creator video lot reading lot book chapter sentence word take lot speech watch think great way helped help isnt bigoted video 
1,would like follow saying op also made video love life matter people u population oppressed century continue oppressed beaten arrested peaceful protest little access education wealth really need people u population finally listen india protesting black life matter england protesting black life matter france japan australia south africa protesting black life matter big issue voice matter important ass fact beyond simply putting one thought research writing research edit learn love life matter course implied first sentence bill right life specifically black life trodden upon point much country forgotten kk one untouchable organization u barely fifty year ago 
2,
3,disappointed reading 
4,shit waddup 
5,giant asteroid potential wipe life ie km size could hit u tomorrow thankfully odds actually happening 
6,good news everyone picked asteroid clinton trump 
7,summarize article way asteroid even get near earth would trajectory severely altered solar surface electromagnetic event one occurs precise moment specific distance range absurdly strong energy level basically sun would repeat highest ever recorded energy event within time frame daysthe odds deemed snowball chance hellif hell nuclear weapon century targeting system elite organization rocket nerd tasked destroying snowballseriously though time resource people never bothered waste resource reading every single news article experience shown get valuable information others expressed easy understand term socially efficient defer people seem smarter biologically ingrained mirror people feelingstldr le puny chance big rock hitting u sorry guy youre gon na keep living planet recycle go vote whatever 
8,giant asteroid ultimate superdelegate 
9,hi hendy thank participating rpolitics however submissionhttpswwredditcomrpoliticscommentssfiquscientistssaygiantasteroidcouldhitearth removed following reason offtopichttpwwredditcomrpoliticswikirulesandregswikithefrfpoliticsontopicstatement submission rpolitics need explicitly current u politics question removal please feel free message moderatorshttpswwredditcommessagecomposetorpoliticssubjectquestion regarding removal submission uhendymessagei question regarding removal submissionhttpswwredditcomrpoliticscommentssfiquscientistssaygiantasteroidcouldhitearthcontext 
10,well get want anywayno didnt read article 
11,giant asteroid comming convention 
12,deleted 
13,might commenter read article 
14,thats better odds powerball 
15,summarize articlethats brilliant 
16,endorsed giant meteor 
17,
18,giant asteroid trump hillary day 
19,thanks reading here relevant politics many people form propagate passionate opinion without putting time get informed 
20,read seeing comment interesting well known 
21,thats real scary thought 
22,haha thanks feel little dumb post removed 
23,actually read article ateroids people reading article 
24,read trying ironic guess 
25,socalled email scandal attack hillary socalled fbi listed number violation investigation seems clear could recommending prosecution isnt even job mind mean violation cease exist patently false someone need dictionary shame clinton supporter see negative truth character attack broke law shes violated number rule regulation shes certainly perjured well still so shes fbi found oig report stated would never future chance presidency there zero reason consequence still apply today get people dont want losing side let face fact whats right fuck sake status winning team doesnt ultimately matterat allwhen nation leadership stakeedittyposwords 
26,well pat err madfit ill remember easy get grossly prejudicial inaccurate fluff piece posted bozemandailychroniclecomthanksoh clinton slimy corrupt po 
27,calling crooked patently false demeaning woman spent life public servicenothing say life public service like bank account 
28,deleted 
29,public service mean end ending well indeed 
30,last thing hillary clinton victim 
31,something wrong doesnt mean attacked itwhat 
32,he funny 
33,deleted 
34,reward psychopathy 
35,vox clinton propaganda rag wouldnt trust anything say 
36,lot people recognize source reason large part bad thing lot people recognize top persecution see lot people express see hopefully vote 
37,let get really popular put prison 
38,shell probably use excuse debate 
39,theyve steady supply cringe election 
40,wt really going today mean garbage 
41,title really something 
42,garbage article moonie time 
43,street hustler sterling academic bona fides always suspect holy fuck guy go hard lol 
44,obama fanning flame racial tension country divisive opinion local law enforcement issue none business 
45,recall three branch government responsibility therein might realize exactly business 
46,wonder he untangled motif shooter yet 
47,obama traveling dallas seek political capital narrative control 
48,okie dokie 
49,still bully pulpit politician make effort right thing 
50,ha ha ha ha ha ha ha hahes killer remote control 
51,apparently police department 
52,hillary campaign already disavowed carbon tax even voted platform delegate also voted ban fracking 
53,could run strongest climate change platform ever wont would principled 
54,could wont 
55,clinton care much environment truth far make presidentor oil company giving cash reason hear speak 
56,hillary clinton must laughing as somewhere bernie people gullible hated primary said much liar said shes running platform want theyre ecstatic truly gullible people ive ever seen lifethis get political situation today 
57,yep accepted federal minimum wage shut hightower amendment carbon tax ban fracking lovely bunch people democratic party 
58,arent happy still 
59,think alot people still dislike concession making feel better supporting clinton general eas worry even illusion clinton character changing better platform thrown window soon shes president know 
60,completely disagree bernie supporter still know shes liar wont thing shes saying shell point 
61,find racial difference either raw data contextual factor taken accounthmm 
62,hi youareforscuba thank participating rpolitics however submissionhttpswwredditcomrpoliticscommentssgnnifullreportonpoliceuseofforcebyproffryer removed following reason exact titlehttpwwredditcomrpoliticswikirulesandregswikidonotcreateyourowntitle headline must comprised copied pasted headline article andor continuous quote taken article using quote reflect article whole recommend using reddit suggest title tends give exact title article offtopichttpwwredditcomrpoliticswikirulesandregswikithefrfpoliticsontopicstatement submission rpolitics need explicitly current u politics question removal please feel free message moderatorshttpswwredditcommessagecomposetorpoliticssubjectquestion regarding removal submission uyouareforscubamessagei question regarding removal submissionhttpswwredditcomrpoliticscommentssgnnifullreportonpoliceuseofforcebyproffryercontext 
63,boo hoo cop scared leftist conspiracy bigger pussy country republican scared shadow 
64,war drug war poor helped cause 
65,commend liberal actually standing enforcementracketeering goosesteppers state right winger consistency complain big government yet support police state 
66,time ever say life matter someone cry blue life matter 
67,httpswwyoutubecomwatchvzkhxxghemoai dont think sam harris republican 
68,oh poor oppressed cop wont people let keep killing people without criticism 
69,necessarily youre generalizing right winger republican meanwhile libertarian well anarcho capitalist support privatization police along police racketeering state le police encounter result kind violence complaining racism wrong survey released morning black harvard professor revealed white men likely shot police 
70,meanwhile libertarian well anarcho capitalist support privatization policeand making profit law enforcement make thing better sound like good also sound like bad along police racketeering statethe stripping away nd th amendment coupled militarized police force prof false survey released morning black harvard professor revealed white men likely shot policeforget racial component everyone killed police however black killed hire rate lower rate armed 
71,family name nothing 
72,please clap 
73,right make people trust helpful thing come dont indict never said innocent comey also threw bus term honesty qualification something dont think going easy recover especially keep running around lying spewing kind crap 
74,wasnt good news terrible horrible news sideshillarys side got proven incompetent awaiting charge perjuryeveryone el side hillary doesnt get go jail like deserves 
75,ask would karl rove situation thats right turn table clinton supporter eat upbut could kill someone live tv get away theyd saying fault victim remember john kerry really war hero thats game sure several pr firm overdrive working helpful disaster 
76,spin spin spin spin lie lie lie spin spin spin spin lie lie lie spin spin spin spin lie lie lie spin spin spin spin lie lie lie spin spin spin spin lie lie lie spin spin spin spin lie lie lie spin spin spin spin lie lie lie hrc 
77,poll number start take dive 
78,comey threw fbi bus sham investigation reasonable prosecutor could easily prove intent given amount evidence 
79,deleted 
80,could werent lying coward zero integrity government check balance dont work 
81,hi zerowantuthri thank participating rpolitics however submissionhttpswwredditcomrpoliticscommentsshasfansangrydonaldtrumpcriticizesberniesanders removed following reasonsthis topic currently covered megathreadhttpswwredditcomrpoliticscommentsshlvsensandersendorseshillaryclintonmegathreadif question removal please feel free message moderatorshttpswwredditcommessagecomposetorpoliticssubjectquestion regarding removal submission uzerowantuthrimessagei question regarding removal submissionhttpswwredditcomrpoliticscommentsshasfansangrydonaldtrumpcriticizesberniesanderscontext 
82,subtle facial tick sander indicating going stay race 
83,hi arslanpk thank participating rpolitics however submissionhttpswwredditcomrpoliticscommentsshdofivethingstowatchatfirstjoint removed following reasonsthis topic currently covered megathreadhttpswwredditcomrpoliticscommentsshlvsensandersendorseshillaryclintonmegathreadif question removal please feel free message moderatorshttpswwredditcommessagecomposetorpoliticssubjectquestion regarding removal submission uarslanpkmessagei question regarding removal submissionhttpswwredditcomrpoliticscommentsshdofivethingstowatchatfirstjointcontext 
84,goodest 
85,like style friend 
86,pm please drop brain slot door 
87,tell city belgium 
88,hi radagast thank participating rpolitics however submission removed following reason already submitted article submitted rpolitics within last three day httpredditsheim bot sometimes make mistake question removal please feel free message moderatorshttpswwredditcommessagecomposetorpoliticssubjectquestion regarding removal submission uradagastmessagei question regarding removal submissionhttpswwredditcomrpoliticscommentsshlmberniesandersendorseshillaryclintoncementing 
89,hi lucrosus thank participating rpolitics however submission removed following reason already submitted article submitted rpolitics within last three day httpredditshkztim bot sometimes make mistake question removal please feel free message moderatorshttpswwredditcommessagecomposetorpoliticssubjectquestion regarding removal submission ulucrosusmessagei question regarding removal submissionhttpswwredditcomrpoliticscommentsshlsberniesandersisofferinghislongawaited 
90,harvard paper actual research article piece junk 
91,middle name really dangeri expect research paper published 
92,article actually wrongonce post finished database fatal shooting police average nearly three death day found serious evidence racial bias police killing unarmed black men x likely white die police gunfire finding fly directly face mr freyer research team harvardthis poorly done analysis extrapolates raw population figure course stupid since different race dont commit proportion population especially come violent crime 
93,quote washington post article linked however black men accounted percent unarmed death even though make percent u population post analysis show black men seven time likely white men die police gunfire unarmed 
94,exactly im referencing clearly show poor analysisedit actually article even misleading due leaving context wow 
95,confused saying context show problem even worse article stated unarmed death caused police black men despite making population 
96,im saying using population number wrong crime especially violent one arent committed proportionally population extremely misleading dangerous way make comparison 
97,ohh get think black people commit crime therefore deserve killed police rate well sorry guy black american make violent offendershttpwwcolorofcrimecomthecolorofcrimerevisededition 
98,chart referencingedit look like youre referecing race victim offender yep reply seems right figure 
99,oh quickly hero fall reality live delusion 
100,mean politician took tactical approach campaigning negotiated another politician get idea supported instead getting none idea supportedwow bernie sander behaving like spoiled toddler better start supporting trump behaves like one time 
101,hed much better rigidly stuck ideology spun isolation irrelevance dont agree 
102,sander said always going oh terrible 
103,karma whore th time posted sub last hour 
104,hi omshantishanti thank participating rpolitics however submissionhttpswwredditcomrpoliticscommentssiosanderssellsoutberniebackshillary removed following reasonsthis topic currently covered megathreadhttpswwredditcomrpoliticscommentsshlvsensandersendorseshillaryclintonmegathreadif question removal please feel free message moderatorshttpswwredditcommessagecomposetorpoliticssubjectquestion regarding removal submission uomshantishantimessagei question regarding removal submissionhttpswwredditcomrpoliticscommentssiosanderssellsoutberniebackshillarycontext 
105,sure sellout clinton sander get rid aroma back smoke filled room deal sander shouldve let process play including waiting delegate cast vote convention couldve gone supporter say lost fair square didnt make deal wasnt business usual etc endorsing clinton convention obvious deal made business usual establishment politics 
106,pile hyperbolic bullshit union leader 
107,almost pity old fool man created monster could control 
108,he continuing campaign convention take fight heart democratic establishment said gon na 
109,im taking campaign conventionguys endorsing hillary yet exactly he said along he going convention fight thereim endorsing hillary im ending campaign conventionguys endorsing hillary exactly he said along he going attend convention 
110,obvious deal made business usual establishment politicsyou mean two public official different policy opinion met compromised work together say isnt 
111,took fight convention way platform he 
112,business usual compromise result deal winner loser deal sander already lost submit tpp probably important issue hate see else caved 
113,hello never thank participating rpolitics topic submission currently discussed length megathreadhttpredditshlv given large scale nature news temporarily removing submission concerning topic community one easy find place discussion news update said submission selected featured megathread op thank contribution subreddit much appreciatedif question removal please feel free message moderatorshttpswwredditcommessagecomposetorpoliticssubjectquestion regarding removal due megathread unevermessagei question regarding removal submissionhttpwwvoxcomberniesandersfuturemichaelkazincontext 
114,bernies campaign showed nation current democratic party new republican party sold banker corporation wall street thief vox like u publication news server pundit supported primary election theft 
115,end resulthttpstwittercomrealdonaldtrumpstatus 
116,trump praying bernie run third party trump possible shot winning cry he truly sunk 
117,true dat 
118,trump possible shot winning poll already show winning 
119,pokmon pokamon might chased angry jamaican 
120,hi brashendeavors thank participating rpolitics however submissionhttpswwredditcomrpoliticscommentssielthepoorgetpoorertherichgetpokamon removed following reason exact titlehttpwwredditcomrpoliticswikirulesandregswikidonotcreateyourowntitle headline must comprised copied pasted headline article andor continuous quote taken article using quote reflect article whole recommend using reddit suggest title tends give exact title articleif question removal please feel free message moderatorshttpswwredditcommessagecomposetorpoliticssubjectquestion regarding removal submission ubrashendeavorsmessagei question regarding removal submissionhttpswwredditcomrpoliticscommentssielthepoorgetpoorertherichgetpokamoncontext 
121,hi cinnamon thank participating rpolitics however submissionhttpswwredditcomrpoliticscommentssihkwhyittookhalfayearforthefullextentof removed following reason offtopichttpwwredditcomrpoliticswikirulesandregswikithefrfpoliticsontopicstatement submission rpolitics need explicitly current u politics question removal please feel free message moderatorshttpswwredditcommessagecomposetorpoliticssubjectquestion regarding removal submission ucinnamonmessagei question regarding removal submissionhttpswwredditcomrpoliticscommentssihkwhyittookhalfayearforthefullextentofcontext 
122,land start rich fuck constantly never suffer single consequence 
123,born rich stay way thanks bailouts grandpa 
124,inherit fortune shit people 
125,obama work way presidency humble beginning trump born rich epitome american dream 
126,started small loan million id epitome american dream 
127,born third base thinking hit triple american dream yes 
128,america slick talking conman sucker person life saving via trump university 
129,well american dream inherit hundred million dollar guess he completely wrong 
130,dream born rich 
131,haha inheriting million dollar rich fuck dad yeah real rag rich story people fucking mental 
132,he almost epitome american dream took million turned billion portfolio whatever value want put he become immense successyeah fucking lazy poor bastard dad dollar controlling interest father real estate empire cant 
133,course anyone successful long born rich 
134,inheriting daddy setting business american dream entitled clueless dumbass 
135,he right dream getting million dollar rich parent 
136,trump born rich inherited fortune pissed away he huge asshole whose brain fried speed actually think make money running president tax return 
137,yes dream came money dream 
138,upvoted lols 
139,finally trump starting pivot toward sounding like mitt romney 
140,son qusay uday 
141,dunno id say gw bush epitome trump damn close second 
142,american dream nightmare 
143,american dream see trump tax return 
144,trump took money fatherhillary took money saudi terrorist 
145,itt lazy jealous ugly people wont amount much life 
146,god damn beat see libertarianism lassizefaire capitalism history u whole 
147,daddy also bailed trump business repeatedly set business contact 
148,there also mil inheritance real estate job contact illegal mil poker chip loan pop 
149,time lent lot 
150,realistically youd probably crack addict 
151,think trump born already home thought hall famer 
152,nice copypaste 
153,already billionare time got dad estate business word startup capital million small even back incredibly well 
154,daddy bail illegally thank million dont know anything cluck 
155,trump take money saudi 
156,ahh saudi terrorist living american dream 
157,lol silly 
158,nah donald became president father company year later forbes estimated total net worth around mjust simple rag rich story little donnie fought way ladder hard work kind word moxie 
159,author missed fact bernies trying bring supporter hillary closest landing spot might go libertarian even trumpetarian saying agrees he saying vote effectively hed said endorse endorse endorse 
160,like chris sense wapo one level headed voice campaign ie criticized queen dont get point course bernie wasnt going endorse dnc platform progressive enough least estimation course he goign phrase way bernie god sake 
161,hello skoalbrother thank participating rpolitics topic submission currently discussed length megathreadhttpredditshlv given large scale nature news temporarily removing submission concerning topic community one easy find place discussion news update said submission selected featured megathread op thank contribution subreddit much appreciatedif question removal please feel free message moderatorshttpswwredditcommessagecomposetorpoliticssubjectquestion regarding removal due megathread uskoalbrothermessagei question regarding removal submissionhttpswwashingtonpostcomnewsthefixwpberniesanderssendorsementofhillaryclintonwasreallyacelebrationofberniesanderscontext 
162,tldr policy agreement 
163,new job 
164,hillary handler must spent endless hour coaching keep plastic smile wildly cheerful eye painted otherwise pained face matter whats happening 
165,ugh wish never happened 
166,dont understand go european mainland style democratic socialism voting libertarian green make sense feeling going sander johnson nothing governing policy 
167,legal pot happening anyway wa state made billion pot legal pot vote like state election california vote yes illegal pot done way state government going say tax dollarsclimate change priority happening anyway whole basis solandra tesla getting preferential treatment government min wage happening anyway already bipartisan support going back primarysanders got new job supporter got press release giving sander credit thing wrere already working way pipe 
168,meet new job old job 
169,plastic smile thats smile thats yes another serving baby expression 
170,wont common cant stand hillary still want govt uterusgrow operationwhatever could fall way 
171,fair california say yes state government unable say tax citizen direct democracy state wrote ballot measure collected signature put ballot voted state government actually little strictly tax dollar 
172,almost impressive much bullshit postlegal pot happening anyway wa state made billion pot way state government going say thatwe trending towards legal pot democrat embraced due sander far progressive way think state government refuse youre full shit youve never met republican party climate change priority happening anyway whole basis solandra tesla getting preferential treatment governmentno wasnt half country approximately still deny existence sander got platform embrace carbon tax progressive measure instead moving center min wage happening anyway already bipartisan support going back primarylol someone born yesterday youre excellent typist flatly untruesanders got new job supporter got press release giving sander credit thing wrere already working way pipebullshit youre completely wrong every point made 
173,oh well democrat put piece corrupt garbage like hillary clinton dnc must watched retarded video 
174,long there electoral college someone still win without majority popular voteand interest state slightly different others cant make vote proportional would mean take dump smaller state 
175,hi llamataste thank participating rpolitics however submissionhttpswwredditcomrpoliticscommentssisocanthiseverhappenintheusa removed following reason exact titlehttpwwredditcomrpoliticswikirulesandregswikidonotcreateyourowntitle headline must comprised copied pasted headline article andor continuous quote taken article using quote reflect article whole recommend using reddit suggest title tends give exact title article datehttpwwredditcomrpoliticswikirulesandregswikithefrfpoliticsontopicstatement rpolitics current u political news information published within last day question removal please feel free message moderatorshttpswwredditcommessagecomposetorpoliticssubjectquestion regarding removal submission ullamatastemessagei question regarding removal submissionhttpswwredditcomrpoliticscommentssisocanthiseverhappenintheusacontext 
176,reality cartoon moron nihilist think merit bringing regard actual politics 
177,dont understand irv would dump smaller state electoral college take dump smaller rural state 
178,overruled next 
