Unnamed: 0,0
2675,would consider example okinawa ramstein offtopic united state military base turkey also stationed nuclear deterrence europe turkey growth islamism civil unrest instablity could direct concern people united state 
2676,obama clinton backed people yes relevant 
2677,question true false thats problem rarely outlet get away straightup falsehoodits sensationalism hyper emotive language better post dispassionate outlet focus fact flavourthe daily express garbage 
2678,ok im sure express seems kinda rightwing conservative shoot messenger reporting fact news like messenger utchocky guy poor social justice warrior regressive left like always getting triggered safe space invaded lmfao dont think like express another link httpwwindependentcouknewsworldeuropeturkeycouplatestnewsistanbulankaraerdogantwitterbeheadingsocialmediaahtml maybe find better source maybe accepts leftwing source like bbc cnn news cuba north korea pravda etc 
2679,deleted 
2680,quite nuclear weapon base locked turkey power cut offthey also seem blame religiouspolitical movement glen coup leader life pennsylvaniaerdogan already said country helping glen considered enemy turkeyso yeah id say turkey quite relevant u momentthat said dont like source express rag think news already debunked entire coup seems made erdogan powerful excuse proper purge political opponent cause declare state emergency well almost look set respect 
2681,youre projecting calm 
2682,ree 
2683,pakistan seized islamomania 
2684,deleted 
2685,problem france lo france large unhappy muslim population failed policy integration 
2686,like national review know single fucking thing jihadist ideology doubt idiot wrote article even know sykespicot 
2687,nro fraidy cat howl war 
2688,invade occupy eradicate idea play long game diplomacy patience 
2689,white people voluntarily child financial reason dont want contribute overpopulation reward thinking reproducing call action leftist need replaced order provide cheap labor maintain gdp wtf want replaced stone age labor slave used birth control want society irrevocably altered zealous incompatible segregated religious community violate everything stand american value society anymore leftist think exist democrat longer war third world stoneage pawn reward responsible fellow citizen dont punish 
2690,islam enemyislam monolithicim saying case true 
2691,policy integration necessary like new citizen go school year prevented living area culture predominate 
2692,far left fails american people want end war best way end war winning democrat party cause endlesswar identifying enemy trying contain enemy accepting limited loss emboldens muslim terrorist trying kill u prolongs conflict cause death destruction fought decade ago win war war didnt want didnt start wed saved countless life side started rehabilitation enemy make friend 
2693,deleted 
2694,really suggesting diplomacy possibility isi dont think know exactly dealing said ideology 
2695,worked wwii idea nazism imperialism 
2696,mean comment another article 
2697,actually idea report read effort point failed 
2698,found robert mcnamaras reddit account 
2699,worst thing country ever listen people like got u isi got u never ending unwinnable war afghanistan youve spread death instability middle east seized people claim want fight every problem american farright point made worse moment sun fucking failed 
2700,deleted 
2701,built school afghanistan rather blowing wedding would generation young adult right would reject extremism 
2702,insurgency end one two way historically public reject insurgent there political settlement rarely group like isi defeated military force gop fails grasp bush administration total failure cant impose violently middle east expect fall hand people vietnam wake call country 
2703,work religious fundamentalist nothing like wwii 
2704,france tends isolate immigrant poor large high rise style public housing project way middle nowhere away job education opportunity add pretty steong streak french nationalismanti immigrant sentiment get poorly integrated immigrant population also history french colonialism africa consider particularly algeria engaged pretty brutal civil war 
2705,sorry dont engage discussion novelty accountsand redditors abusive uncivil get blockedwrite back want know moment ill never suffer reading 
2706,thats true nation owes big debt gratitude bush cheney rumsfeld et al keeping u safe scourge muslim terrorismi shudder imagine gore would mishandled situation election 
2707,build school local blew 
2708,deleted 
2709,deleted 
2710,hopelessly naive view life taliban disfigured beat killed female child went school blew school approve afghanistan involved near continuous series bloody conflict hundred year coup ended monarchy established republic triggered succession coup assassination came pdpa soviet invasion call religious orthodoxy multination movement resulted extremist ideology driving force politics idea response western intervention incorrect obstacle establishment caliphate righteous sharia theocracy 
2711,nothing like anything else say cant win though defeatism unamerican win war muslim terrorist first decide want win 
2712,deleted 
2713,keeping u safe scourge muslim terrorism happened never forget president whose administration ignored intelligence bin laden 
2714,good job blowing middle east nothing bad could ever come 
2715,school teaching girl lem see didnt specify 
2716,kill firstborn male child dont forget 
2717,im deeply sorry didnt lay comprehensive plan supply defense administration school kind infrastructural improvement necessary go thembut hey maybe youre right destroying stuff way thats vietnam right 
2718,bomb idea make idea insane 
2719,gore would done bubba obama doingignore problem shake fist promise rest justice served launch missile empty target tell american people policy success accept limited killing avoid total war 
2720,whose administration ignored intelligence bin ladenbill clinton sudanese bin laden custody offered u clinton feared political fallout declined 
2721,thats true also defeatism anything put mind nazism imperialism idea defeated 
2722,deleted 
2723,thats pretty well debunked myth selfappointed nonstate actor considered unstable intelligence agency offered sell bin laden u explored offer determined unreliable declinedheres snopes page debunking clinton passed obl nonsense httpwwsnopescomrumorsclintonasp 
2724,idea defeated idea beat german fighting defeated nazi better idea foolish invasion iraq predictable outcome stupidity finest inflamed situation 
2725,im sorry reversed course decided fight muslim terrorismthis nation owes great debt gratitude bush cheney rumsfeld et al keeping u safe scourge muslim terrorism thankfully opinion held small insignificant minority american 
2726,youre wrong well documented sudanese president wanted sanction lifted offered arrest deport bin laden make happen clinton refused put pressure sudan send bin laden back afghanistan 
2727,youre wrong first defeat enemy war win idea cant one important understand war decade enemy consider war u foolish dangerous recognize also important understand war didnt want didnt start best way end war win doign cause innocent life lostfoolish invasion iraqyou dont understand diplomacy alliance work kuwait ally duty bound protect iraq invaded bush put together coalition drove iraq signed ceasefire agreement proceeded violate soon clinton nothing took office mean alone every right duty invade removed violent despot power freed people better stabilized region brought inchoate democracy country respectable accomplishment 
2728,deleted 
2729,please cite source 
2730,im still waiting source bruh 
2731,good job freeing people iraq bravo clap clapi dont think understand consequence hamfisting way iraq blowing established order entire region crusade free people sensible ally like canada france germany country region tried stop u making historic blunder knew would unleash murica wasnt good work mission accomplished 
2732,quinnipiac poll proven observational bias lean far far left 
2733,know search engine work 
2734,iraqi people better saddam thats indisputable 
2735,first wife said oath trump raped hair plug hurtthen another woman said oath trump attempted rape herso strike three seems like lot rape associated guy 
2736,sound like might mexican 
2737,removed 
2738,disgusting turd human beingagain thats acceptable dialog 
2739,removed 
2740,removed 
2741,hi nobreakstrumptrain thank participating rpolitics however commenthttpswwredditcomrpoliticscommentstgdmdonaldtrumpchildrapeallegationdeydbu removed following reason comment meet comment civility ruleshttpswwredditcomrpoliticswikirulesandregswikipleasebecivil please flame bait user continued violation comment rule may result ban rpoliticsif question removal please feel free message moderatorshttpswwredditcommessagecomposetorpoliticssubjectquestion regarding removal comment unobreakstrumptrainmessagei question regarding removal commenthttpswwredditcomrpoliticscommentstgdmdonaldtrumpchildrapeallegationdeydbucontext 
2742,know third time court donald accused rape time even witness rapingwhat evidence need 
2743,accused doesnt make turd 
2744,something advocated known liar would nice yes im referencing community 
2745,removed 
2746,posted wrong account silly 
2747,use one account 
2748,oh busted alt account lol 
2749,he probably unsophisticated easily confused there lot going around lately 
2750,reported title bye 
2751,hi trumpprospectus thank participating rpolitics however submissionhttpswwredditcomrpoliticscommentsrqomtrumpspal removed following reason exact titlehttpwwredditcomrpoliticswikirulesandregswikidonotcreateyourowntitle headline must comprised copied pasted headline article andor continuous quote taken article using quote reflect article whole recommend using reddit suggest title tends give exact title articleif question removal please feel free message moderatorshttpswwredditcommessagecomposetorpoliticssubjectquestion regarding removal submission utrumpprospectusmessagei question regarding removal submissionhttpswwredditcomrpoliticscommentsrqomtrumpspalcontext 
2752,hi undueinfluence thank participating rpolitics however submission removed following reason already submitted article submitted rpolitics within last three day httpredditrjmgim bot sometimes make mistake question removal please feel free message moderatorshttpswwredditcommessagecomposetorpoliticssubjectquestion regarding removal submission uundueinfluencemessagei question regarding removal submissionhttpswwredditcomrpoliticscommentsrqqhousedemocratsbooberniesandersincontentious 
2753,submission removed automatically per sidebar rule post link active poll petition allow article petition story focus result closed petition unique aspect current petition active poll petition inandof itselfmore information found herehttpwwredditcomrpoliticswikifiltereddomainswikipetitionfadvocacywebsitesi bot action performed automatically please contact moderator subredditmessagecomposetorpolitics question concern 
2754,hi joake thank participating rpolitics however submissionhttpswwredditcomrpoliticscommentsrqhujlivefbichiefjamescomeytestifiesonclinton removed following reason cap breaking rule applied even actual title article cap contains word breaking rule may applied single word declarative andor sensational expression exclusive hot click detailshttpwwredditcomrpoliticswikirulesandregswikifollowreddiquettestitleinstructionsif question removal please feel free message moderatorshttpswwredditcommessagecomposetorpoliticssubjectquestion regarding removal submission ujoakemessagei question regarding removal submissionhttpswwredditcomrpoliticscommentsrqhujlivefbichiefjamescomeytestifiesonclintoncontext 
2755,well heck come bastion diversity federalist wasnt cherry picked support narrative sir 
2756,dont think ignorant redneck make good parent wonder well see federalist talking 
2757,someone desperate confirmation bias httpwwhindawicom 
2758,hi chosennaame thank participating rpolitics however submissionhttpswwredditcomrpoliticscommentsrqjhanotherstudyfindssamesexparentingisntbest removed following reason offtopichttpwwredditcomrpoliticswikirulesandregswikithefrfpoliticsontopicstatement submission rpolitics need explicitly current u politics question removal please feel free message moderatorshttpswwredditcommessagecomposetorpoliticssubjectquestion regarding removal submission uchosennaamemessagei question regarding removal submissionhttpswwredditcomrpoliticscommentsrqjhanotherstudyfindssamesexparentingisntbestcontext 
2759,argument always whether gay make best parent 
2760,another study find federalist bunch right wing psychosimagine oregon occupier get brain transplant education youre half way 
2761,deleted 
2762,age looking kid raised entirely samesex marriage legalized fact raised time stigmatization parent 
2763,certainly rolling back gay marriage important part judicial view 
2764,federalist doesnt look mirror often thats mean 
2765,aww fun destroying author credibility 
2766,look study author effort see trendhttpwwhindawicom 
2767,yeah bias httpwwhindawicom 
2768,dont behave better result better 
2769,nice link 
2770,people arent going shitting theyre parent gay make difference acceptable 
2771,
2772,received treatment neither criminally charged 
2773,criminal charge filed allowed administrative actionfinally clinton action showed intent defraud unlike soldier decided choice short circuit chain commandand finally editor newspaper trying deflect sexual harassment trump racism rape minor 
2774,come false equivalency let answer one soldier governed ucmj military regulation isnt 
2775,military civilian law different 
2776,usmj different civilian law 
2777,wasnt charged wasnt treatment adminstrative punishment isnt possible leave job idiot 
2778,similarity committed act treasondifferences one could next presidentnew usa motto life liberty treason 
2779,fox news roger ailes old nixon crony fox sort news republican could 
2780,httpswwyoutubecomwatchvgxenqyw 
2781,sacramento cahillary r clinton pleaded guilty today unauthorized removal retention classified material united state attorney benjamin b wagner announcedus magistrate judge kendall j newman immediately sentenced clinton two year probation fine forfeiture personal medium containing classified material clinton ordered surrender currently held security clearance never seek clearanceaccording court document clinton secretary state role secretary state clinton access classified briefing digital record could retained viewed authorized government computer clinton however caused material downloaded stored personal unclassified electronic device storage medium clinton continued maintain information unclassified system unauthorized location copied material onto least one additional unauthorized unclassified systemclintons action came light march benghazi panel discovered handled classified material inappropriately clinton later admitted lawyer destroyed large quantity classified material maintained home despite federal bureau investigation searched clinton home august agent recovered numerous classified material digital hard copy form investigation reveal evidence clinton intended distribute classified information unauthorized personnelthis bryan nishimuras fbi press release edited clinton name im spamming telling also know isnt marine story find nishimuras situation comparable 
2782,removed 
2783,chosen one mother dragon silence plebe 
2784,removed 
2785,case marine careerchanging consequencesit remains seen hillary affected poor decision 
2786,misspelled clinton brought rape 
2787,deleted thishttpspastebincomguvif 
2788,didnt read understand fbi conclusion clinton case 
2789,forced removed classified document kept laptop could write book based themalso forced bit much honorably discharged marine reserve already served term combat zone defined marine meet exceeds mission unit proficiency personal conduct code requirement awarded honorable administrative discharge marine excused medical psychological issue impair ability serve would otherwise performed honorably also eligible honorable discharge case marine awarded type discharge status amended honorable given exceptional achievement postmilitary life 
2790,idiotslol 
2791,heridiotsclassictrump still losing lol 
2792,career changing firefighter reserve finishing active duty got honorable discharge reserve continues life firefighter received early release remaining obligation serve honor would call blessing 
2793,misspelled clinton brought rapehe talking pedophile rapist know guy keep talking banging daughterhttpwwdailymailcouknewsarticledonaldtrumpfuriouslydenieswomansclaimsrapedtycoonbillionairepedophilejeffreyepsteinssexpartieshtml 
2794,here chance educate different 
2795,removed 
2796,hillary honourable discharge government free continue making money speaking circuit would seem pretty fairwhat think 
2797,ok woman claiming raped trump let get story let find know shes liar anita hill didnt work wont work nowbill clinton victim come forward savagely attacked hillary clinton anyone heart defend hillary rape victim 
2798,wasnt allowed remove classified material base wasnt allowed view anything base computer certainly wasnt allowed copy laptop take home intentionally mishandled classified informationhttpwwnbcnewscomnewsusnewshowhillaryclintonsemailcasecomparessimilarfbiprobesnif clinton stuffed paper bag dragdropped onto thumb drive taken home would show intent remove retain classified information 
2799,look dont need educate youits responsibilitybut issue intent nont hrcs case clear casesecondly there issue effect im arguing evidence guccifer anyone else got clear evidence guy leaked lotand thirdlyoh never mind 
2800,love took knowledge case fox news video really digging deep theretry insteadhttpwwmilitarytimescomstorymilitaryarchivesbrezlershouldbeseparatedboardfinds 
2801,well look around expert want educate people hrc shot whatever evidence fbi lolits reddit fun 
2802,military guy free run president prove hrc may mishandled secret ok 
2803,bill clinton victim come forwardthe woman claimed victim gave sworn statement never happened doesnt standard apply well 
2804,investigation reveal evidence nishimura intended distribute classified information unauthorized personneljust like comeys investigation clinton intend distribute classified information difference clinton actually distribute classified information someone clearance according comey reason comey let slide hillary getting legal advicesecondly evidence anyone got server fbi release supposingly readgiven nature system actor potentially involved ass would unlikely see direct evidence ass hostile actor gained access private commercial email account people secretary clinton regular contact personal account also ass secretary clinton use personal email domain known large number people readily apparent also used personal email extensively outside united state including sending receiving workrelated email territory sophisticated adversary given combination factor ass possible hostile actor gained access secretary clinton personal email accountthirdly asked educate could actually educate 
2805,investigation reveal evidence nishimura intended distribute classified information unauthorized personnelthen delete cooperate investigation startedactually distribute classified information someone clearance according comey citation needed 
2806,appears equally successful see received fair treatment based conduct continuing pretend posting fbi quote attempt convict hrc court public opinion youve already lost real caseactually backt couple point hrc distribute way soldier reference thishttpthefederalistcombreakinghillaryintentionallyoriginatedanddistributedhighlyclassifiedinformationget better referencesyour extensive quote carefully read support mefinal verdict completely clear administrative punishment educating wanted arrive atr conclusion taht somehow guy getting worse deal hrc ro law applied incosistenlty recieved administrative discipline available hrc wella swing missbut thank allowing clear saidand please dont consider career professor 
2807,one lawyer didnt clearancehttpwwpoliticocomstoryjamescomeytestimonyclintonemailnumber delete cooperate investigation startedand asked fbi question news release maybe reason clinton lawyer deleted email left impossible forensically retrieve 
2808,since fbi news release good reference fml 
2809,clear administrative punishment cant seek security clearance even read original post great career thanks concern 
2810,one lawyer didnt clearancethe lawyer sorted email rest irrelevanti think get good legal representation make production state departmentand none known contain classified information time anywayand asked fbi question news release maybe reason clinton lawyer deleted email left impossible forensically retrieve themthe server declared private property doj last heard government doesnt owe private property 
2811,fbi news release support megood luck persecution herbut others doneand see major got even better treatmentthan hrcsmh 
2812,cant seek security clearance againhe shouldnt able willfully distributed disobeying order malicious intentactually appeal decision understand go executive branchso explian he president clintonxd 
2813,server private confidential government email contained 
2814,forgot include earlier paragraphas concluded questioning chaffetz asked whether clinton gave noncleared people access classified informationyes comey said repeating yes 
2815,except fbi came conclusion didnt distribute material wasnt malicious intent please read getting frustratinghttpsmfbigovhttpswwfbigovsacramentopressreleasesfolsomnavalreservistissentencedafterpleadingguiltytounauthorizedremovalandretentionofclassifiedmaterialshe guilty unauthorized removal retention classified material clearly stated 
2816,comparisonclinton stored classified information unauthorized server unauthorized location retained classified material unauthorized server unauthorized locationthis straight comey seems like guilty unauthorized removal retention menishimura stored confidential information unauthorized phone retained information home unauthorized location must better thing bicker agree disagree 
2817,confidential government email contained itwrongthere question former secretary clinton authority delete personal email without agency supervision appropriately could done even working government server policy issue national archive record administration nara state department individual officer employee permitted expected exercise judgment determine constitutes federal recordsee nara bulletin sept currently many agency employee manage email account apply understanding federal record management mean employee required review message identify value either delete move recordkeeping system department state foreign affair manual fam b intention guidance require preservation every email message attached ex purpose policy direct preservation message contain information necessary ensure departmental policy program activity adequately documented email message creator recipient must decide whether particular message appropriate preservation making decision personnel exercise judgment use determining whether retain file paper record httpsassetsdocumentcloudorgdocumentsstateobjectionspdf 
2818,concluded questioning chaffetz asked whether clinton gave noncleared people access classified information yes comey said repeating yesagain didnt knew classified everything else irrelevant 
2819,guy think would endorse trump hahaha 
2820,okay bernie everyone break eventually 
2821,latest reversal polling cycle highly erraticcouldnt said better 
2822,maybe tied clinton past year based aggregate polling recent reference small period time mccain romney pulled slightly ahead obama aggregate however generally speaking person ahead vast majority time obama seems like may case well 
2823,wont competing team usa attentionthe rio olympics launch august opening ceremony rio de janeiro come merely week close democratic national convention turning medium attention away clinton time still enjoying postconvention glow could mute clinton convention bounce benefit trump long runis serious analysis wishful thinking 
2824,kerry ahead swift boating late summer 
2825,sound like wishful thinking hillary strategy general seems lay low let trump disaster campaign take headlinesso visible isnt something hurt strategy seems 
2826,le week rnc attention turned trump except instead olympics dnc seems worse lol 
2827,well minority vote higher based trend line trump soo poorly minority female voter much worse bush ever according polling data dont see something work honestly back election bush kerry pretty tight term poll going back forth time september bush took leadthe interesting thing negative news might serve white noise point unless someone killed guy something break september 
2828,trump turning obama number mainstream republican percent uptick minority constitute population isnt great 
2829,trump turning obama number mainstream republican percent uptick minority constitute population isnt great 
2830,combine much worse minority whole mean think lot trump supporter greatly underplaying many minroities hate trump mean dont get unfavorable rating black people unfavorable hispanic nowherethis look like disaster loses mean gop going explain nominating trump minority group need stay viable future particularly hispanic onesthat nomination turnout doesnt mean shit respect poll general election otherwise obama would point polling towards instead right line poll number everyone show general election bad news trump minority lot woman hate guy 
