Unnamed: 0,0
4061,kidding bernie appeal democrat independent trump even republican he candidate favorability rating thats positive bernie would kill trump 
4062,hahahahahhahahahahhahahahhahaha killed yet 
4063,deleted 
4064,dont want trump win cant deny wouldnt satisfying watch 
4065,whats shocking seem think dem party legitimacy exists currently nominating unpopular presidential candidate history candidate criminal investigation fbi real possibility indicted war hawk pro torture pro israel pro nsa pro drug warthe democrat deserve lose based weak shit nominated presidenthillary person nominate fucking serious 
4066,people never going vote always going call criminalthe rest u call madame president 
4067,article say within next two week expectation announcement charge brought clinton long evidence wrongdoing emerges interview fbi source familiar investigation told cnnuhh super journalism got one expectation fbi indict clinton turn broke law 
4068,like wolftray dont like source admit asking valid question heard rumor biden maybe stepping nominee 
4069,plus ctr would losing job really quickly imagine killing correct rectord 
4070,ok looked shady admit yet see proof somehow influenced decision 
4071,
4072,bernie lost democratic primary democratic support weak he antithesis american conservatism republican going vote nonchristian socialist 
4073,goodman going strong youtubehttpswwyoutubecomchannelucdbxreuyyqtftndkzfnavideoshis last video uploaded hour ago httpswwyoutubecomwatchvziwglxnpj 
4074,promised seppuku sander got nom 
4075,id rather see hillary indicted imagine shes spent entire life waiting president sold soul long time ago get campaign contribution bank engineered wall street hijinks led u great recession shes friendly lobbyist shes politician truest senseand last minute shes indicted dream hope ever president dashedid give anything room see face go person who spent every last moment life conniving strategizing president would ultimate win 
4076,attacking like support hillarynewsflash 
4077,sure scandal scandal whether shes indicted put jail 
4078,probably would voted 
4079,hypothetical ctr shill stop shilling mean get word happened assume wont get paid keep working try sue paying work hour 
4080,hence original post doesnt prove anything 
4081,rectum 
4082,record 
4083,paid attention youd see problem nearly every dem primary contest many error broken machine party affiliation fucked republican comment many many republican hate trump would much rather vote bernie 
4084,holy shit ive never seen irl he like caricature bernie supporter 
4085,post made sound like dnc legitimate political party worth caring dems deserve lose clear dug grave nominate literal trash like hillary deserve lose anyone think answer eminate either dems republican fucking crazy people dont even deserve throw gut bear propagandized citizen fascist dictatorship 
4086,fox news call something scandal doesnt mean 
4087,
4088,dont know time dont think reddit twitter facebook sometimes thing happen make think real maybe hillary bunch weirdo supportersi guess assuming exist probably working call center guess india probably contract im sure company work get paid shilling someone campaign call cancel contract indicated whenever someone campaign get around 
4089,prove 
4090,sander supporter coopted rigged voting machine conspiracy theory often employed left right bernie would face even rigging general bernie combine thing republican hate trump populist protectionist etc plus everything hate liberal 
4091,shes nd unpopular candidate history fbi legit investigating isnt republican conspiracy reality 
4092,agree charge arent brought doesnt mean cant scandal honestly information already know server already legit scandal 
4093,im person ever called criminal assuming doesnt become criminal never willbut beginning cycle assumed would vote november among thing development involving private email server decision public statement regarding controversy brought integrity question enough longer assume vote heryou essentially said two type people always going vote call criminal im informing going vote likely call criminal unless becomes legal definition responding comment 
4094,need cheney tell knew hussein didnt wmd youll believe truesome thing naturally tried court public opinion person character past behavior taken opinion drawing conclusionsthen loyalist consider wrongdoing happened conclusive proof open see think ever going get unfiltered truth situation ive got land water florida id like sell youre going take clinton word reason mentioned first post im going spend long trying change opinion 
4095,scandalized idea organization size u department state crappy service procedure somehow isnt surprising 
4096,assuming fbi come back decision crime committed youre going vote didnt respond correctly inaccurate claim breaking lawi see make total sense 
4097,really dont eat shit feed seriously admit wrong thing still like support 
4098,doesnt rise criminality infraction highly unethical behavior dangerous especially commander chief person responds criticism unethical behavior also taken account casting vote didnt say reason element behavior cast doubt integrity appear pattern behaviorfurther know damn well acquittal lack indictment doesnt mean lack wrongdoing mean many thing including lack strong enough evidence produce likely conviction notice jw case clinton aide lawyer basically guarantee get story straight thing like strong representation work wonder concealing evidence like lawyer decide personal email find threw email pertinent exactly matter handthere ton people think oj even though acquitted ton people think didnt wouldnt change mind even convicted even would say shouldve acquitted even people think robbery sentence comeuppance acquitted crime obviously committed think rightclinton already guilty thing eye many many people many country distrustful power enables people wrong get away many people believe shes powerful enough avoid prosecution matter 
4099,also used analogy elsewhere need cheney bush member administration convicted crime believe committed applying different standard democrat republican democrat killing democrat friend two set rule depending whose team youre playing 
4100,really doesnt matter broke law people wont vote 
4101,look silence democrat last year obama ran platform ending war shutting gitmo reality expanded war militaristic bush ever torture policy war crimesbush took terrorist plane took elsewhere torture obama kill people suspected terrorist he pro israel refuse recognize israel settlement illegal war crimeshes vaporized thousand innocent people result droneshe spied u via nsa warrantless wiretapping nothing hold responsible great recession responsible fact bailed banker faced punishment he made u le safe result drone program war crime gitmo still existence done shit end environmental crisis he possibly worst president ever term civil liberty dont understand people democrat obama isnt democrat he centrist democrat like hillary elected obama fight u worker poor soldier bring soldier home end fucking illegal warwhat donehes war criminal prosecuted 
4102,lack indictment doesnt mean broke law everything know fact enough turn notinsignificant number democrat begin withi think funny boil either hate hillary youll vote maybe behavior becoming president 
4103,blog think news us trump like nickname 
4104,oh breitbart wonder gibberish 
4105,article shit site article shit site maybe buzzworthy make series gifs complete triumvirate 
4106,fbi tarmac stopping photo later fbi livid meeting 
4107,garbage althought there one funny thingbill clinton one talented politician past century supposedly infallible skill continue fail put service someone himselflulz 
4108,god damnit dont get hope fucking video stupid ha fucking goodman goofy motherfucking face 
4109,think going see lot 
4110,dont think mistaking email nonscandal something real criminal negligence anyones partlook someone look know there nothing look real problemlike ensuring trump character adhd racism dont destroy country 
4111,httpstwittercomrealdonaldtrumpstatusrefsrctwsrcetfwlol 
4112,indictment imminent 
4113,youtube post worst 
4114,there proof talked review 
4115,ok ok here looking forhttpswwyoutubecomwatchvdlzxrzfcyos 
4116,thats clinton motto right could worse 
4117,past year 
4118,cant believe clicked every single time 
4119,advertisement video really kind kill whole thing 
4120,campaigning opponent negative done every election since beginning time 
4121,fbi disclosed finding yet 
4122,ad 
4123,lifelong naacp rated byrd voting record mourned death 
4124,robert byrd bad person spent lot late year trying reform involved civil right legislation apologized every chance could instrumental huge voice opposition iraq war bad person yes example people learn mistake try make thing better 
4125,lol isnt even remotely true 
4126,byrd changed way entirely recognized wrong tried make amends weve come far moral right apology seen weakness faultthis disgusting 
4127,hi krombopuloscolt thank participating rpolitics however submissionhttpswwredditcomrpoliticscommentsqzoimhillaryclintonsmentorrobertbyrdwasa removed following reason personal blogsvlogs personal blog personal medium channel allowedif question removal please feel free message moderatorshttpswwredditcommessagecomposetorpoliticssubjectquestion regarding removal submission ukrombopuloscoltmessagei question regarding removal submissionhttpswwredditcomrpoliticscommentsqzoimhillaryclintonsmentorrobertbyrdwasacontext 
4128,trump racist 
4129,deleted 
4130,op doesnt know term life long mean 
4131,say nacp suported member kk 
4132,deleted 
4133,deleted 
4134,daily reminderhttpsiimgurcomcfytyjpg 
4135,trump racist took full page ad calling murder five innocent black child called hillary crooked using star david pile cash keep pretending he 
4136,deleted 
4137,yes former member ended supporting civil right famous big stand civil right act eugene robinson byrd redemption httpwwashingtonpostcomwpdyncontentarticlearhtml 
4138,im sure trump white supremacist reddit support staff take issue much naacp saynormal nonracist ameicans hand 
4139,im curious know anything posting pretty much common knowledge reformed klansman 
4140,already knew photoshop existed didnt need reminder 
4141,goddamnit support trump clearly shop everyone know including people posting posting dishonest 
4142,trump racist took full page ad calling murder five innocent black childrenthey werent innocent 
4143,op done posting wackjob garbage occasionally playing reasonable comment 
4144,yes first everyone innocent proven guilty dna cleared completely entirely innocent trump wanted dead 
4145,dna cleared completelythe kid admitted rape knew happenedall confessed beating denied actually raping detailed corroborated confessionsdna never cleared hair blood semen five defendant womanmatias reyes guy confessed statute limitation passed also serving life sentence anyway 
4146,even werent threatened coerced likely thats still capital crime know didnt rape honestly beat someone else found raped please there always lot riding falsely convicting someone offer guy who already serving life matter small token make life le awful youre hook star david calling hillary corrupt 
4147,know didnt rape herthen semen found hereven werent threatened coerced likely thats still capital crimelol confession video taped parent lawyer contradict eitherthey guilty rotten snake shouldve quartered hangedhow star david calling hillary corruptwho hillary top donor 
4148,semen found heri think better refresh memory casehttpwwcnncomjusticenewyorkcentralparkfivewho hillary top donor againdo proof crime may committed jewish connection like republican arent owned isreal adelson 
4149,deleted 
4150,sure want loose sovereigntyand gain benefit unhinged trade across wealthiest market planetlets pretend like joining eu doesnt tremendous economic benefit yes give modicum authority term domestic policy nothing lot country large swath electorate believe trade worth may disagree worthwhile value absolute sovereignty else im dismissing belief matter dont get naively fallaciously pretend like economic pro arent thereyeah large single market economy euro worked well greecewhats hurting greece isnt eu eurozone specifically fact theyre monetary union lack fiscal transfer required offset inevitable trade deficitsuk boat uk eurozone unique great position enjoying benefit unhinged trade wealthiest market without losing monetary lever fiat currency give want back eu later benefit highly unlikely rest eu going allow dodge eurozone second time food thoughtterrible uninformed piece little anything explain situationyes terrible uninformed piece one responded equally terrible uninformed comment 
4151,deleted 
4152,unhinged eu regs followfigure speechthere arent usual tax tariff custom trading eu member course whats sold subject common set regulation would place even country eu member movement whats sold occurs bordersnow well let see join euro join eu take face valuewere discussing uk brexit uk special position eu member without part eurozone reaping benefit beyond country reapand took load debt german european central banki dont think understood talking aboutnormally country like greece strong domestic production trade country like germany there deficit greece cause debt greece currency could devalue shrink debt motivate foreign investment would strengthen domestic product eurozone take lever away themthe kind deficit occurs different u state monetary union u dollar whats different u also system fiscal transfer way federal government collecting tax one state spending social service another fiscal transfer offset deficit debt importing state incur exporting state monetary unionsince eurozone lack kind fiscal transfer end greece mountain debt since pay eu forced periodically forgive reduce greece debt word circumstance force eu certain kind inefficient fiscal transfer mechanism via debt forgiveness greece suffers meantimei didnt go great detail last post notion greece incurring debt already baked description trade deficit point bringing upthe point none applicable uk uk eurozone theyre enjoying trade benefit eu without suffering loss monetary lever thats fantastic position leaving eu really really really bad idea uk theyre never getting unique status backyet much eu push ever tighter fiscal policy unionthey push lot actually see regarding eurozone really desperately need true mechanism fiscal transfer ie tax germany spend greece order make monetary union functional dont push far story greece repeat every periphery economy incurs deficit export monster like germany franceusually point question asked france germany get paying tax spent greecethey get stable market full consumer actually afford buy good furthermore wasnt periphery economy france germany export leader would increased value euro making harder sell good outside eu market stand periphery suppresses value euro allowing domestic production compete much easily abroadwhich say france germany actually benefit lot eurozone maybe time started paying due periphery theyve thus far exploiting ehwhich electorate decided tradeoffsure uk every right toim pointing people electorate elsewhere dont share sentiment lot reason stay eu ultranationalist ideology sovereignty arent absolute universal truth everyone followthe eu pushing quickly article triggered quickly imagine quite general election coming nothing election everything market going haywire there great deal uncertainty right uk need take action one way quickly market see future bake cost price instead riding insane spike pitfall monthshonestly think going happen finance world uk voted leaveyou didnt even touch turkey pand im going im turk living u detest turkish government deserve every shit fling fucking ruining country 
4153,
4154,looking jewish mole would stereotyping first time called ally spied usisraels espionage activity america unrivaled unseemly counterspy told member house judiciary foreign affair committee going far beyond activity close ally germany france uk japan congressional staffer familiar briefing last january called testimony soberingalarmingeven terrifying another staffer called damaging httpwwnewsweekcomisraelwontstopspyingushtml 
4155,well today learned trump stereotype greedy 
4156,oh well thanks clearing 
4157,today learned anti trump people think two triangle put together automatically equal star david 
4158,jew monopoly hexagram symbol 
4159,daughter ivanka jewish 
4160,today learned racist think six pointed star star david guess obsessed hatred jew would see target hate everywhere 
4161,antitrumpmy entire fb feed full jew horrified trump tweetmany republican happen jewish friend didnt read single one defending trump action 
4162,gon na call b dont get horrified fucking shape 
4163,hahaha horrified general m paint shape wasnt even star david real hew think six pointed star thing star david 
4164,wasnt lol 
4165,general m paint shapefail 
4166,dont think dis article stay long time page wish everybody u would read 
4167,better starting war 
4168,apparently republican cant choose better trump democrat cant choose better hillary 
4169,neocon go support neocon hillary war bailouts bullshit itll like 
4170,thank gop hillary job 
4171,donnie dont need national party win win win 
4172,clinton slightly higher likeability rating gilbert gottfried bobcat goldwaithe singing heart go duet orgasming one successfully helping 
4173,shes winning dems love republican dont else new 
4174,forgot put foundation tittle somewhere 
4175,politifarce 
4176,sorry thought wasnt enough clinton email front rpolitics 
4177,right nothing burger story there need lot coverage plus look coverage getting network television news everywhere 
4178,ikr think email thing distraction factor story foundation 
4179,clinton email system 
4180,free advertising nothing burger could great addition mcdonalds 
4181,dont understand totally agree thats im putting 
4182,convenience 
4183,could whole promotion hillary indicted everyone get free nothing burger 
4184,he ridiculing actually 
4185,dont think understand think there much story everywhere ignore non story 
4186,doesnt make much sense 
4187,im spreading word clinton email may someone browsing rpolitics hasnt seen 
4188,used shuriken 
4189,im sure perfectly good notatall antisemitic explanation roll eye 
4190,last checked shape one meaning 
4191,post today full white supremacist trying tell jew understand implication putting star david pile cash better jew doits really reddit worst 
4192,thread hasnt removed offtopic trump making boo boo thread made fbi making boo boo killing nightclub goer orlando offtopicpolitics shit politician government organization function bad mod dont see way 
4193,mogen david two interlaced triangle please provide evidence solid red star david flag city chicago four sixpointed red star one stand great chicago fire obviously antisemitic event engineered trump ancestor long time membership hitler youth 
4194,picture wasnt even close star david article posted nonstop day misleading title last 
4195,even though trump daughter family jewish even though trump spoke highly israel people aipac conference still racist asshole hillary clinton best ever 
4196,america us pentagram flag 
4197,everybody agrees worst purely accident right gain 
4198,create picture found somewhere else tweeted knowing special snowflake would search something offended 
4199,jew monopoly six point star sheriff department around country antisemitic many use star microsoft paint antisemitic star default shape star yellow blue critic may point considering daughter jewish grandchild jewish sheldon adelson pledged million campaign safe assume wasnt antisemitic 
4200,exactly star graphic intensifier primary symbol religious faith time choose disregard latter symbolism inconvenient quite foolish though fact well grounded european history thousand year im sure swastika good luck sign eh know go wearing one people might get wrong idea 
4201,source image designer clearly antisemitehttpsarchiveisedto 
4202,agree im still sold fact meant antisemitic response reddit really bad lot jew know uncomfortable star david pile cash say corrupt candidate ever dont worry jew reddit know antisemitism theyre going tell 
4203,source imagehttpsarchiveisedto 
4204,difference star star david mean point created two intersecting trianglesps apparently star david isnt really star david medieval kaballah symbol later used nazi identify jew doesnt biblical original prove wrong find ancient bc hebrew monument us 
4205,wasnt even close yeah bullshit clearly star david fucked tweeting stop defending deleted tweet knew fucked 
4206,deleted 
4207,praise hail satan 
4208,even jewish star david literally default star use shape m paint saying microsoft racist pushing everyone paint use star david invoke holocaust memory course point star doesnt mean represents jewish star medium hitjob amazed many people buying doesnt even look like star david traditionally represented crossed line completely absurd 
4209,retarded orange buffoon fault ever retweeted blindy cant read retarded understand meaning 
4210,youre narative democrat party nominee interrogated fbi criminal invvestigation shes embroiled trump tweeted thats story trump tweeted 
4211,swastika different meaning depending viewer culture value inconvenient shape gave meaning nothing 
4212,im worried pentagram u flag 
4213,deleted 
4214,httpmimgurcomfvzreswhat 
4215,probably getting tweet chanhere source imagehttpsarchiveisedto 
4216,there nothing satanic united state america united state america nsatasatanoh shit 
4217,literally default fucking m paint shape see herehttpswwgooglecomsearchsitetbmischsourcehpbiwbihqmspaintshapesoqmspaintshapesgslimgijij acimg jfhsfdbheyare play doh shape racist must behttpsiredditbjiwigxxpng apparently google adobe microsoft guilty antisemitism wellhttpstwittercomrogerkinstatus 
4218,many many people gave meaning fundamental idea symbol link meaning put word corrupt sixpointed symbol judaism atop pile money another symbolic linkage going raise eyebrow meaning exists de facto whether desire meant anything symbolism good designer use symbolism layer resonant element meaning inside single image make complex powerful multiple meaning work together within single image produce poetic resultif nothing else designer didnt purpose arent well trained perhaps swiped pol alleged case would quite definitely intentional 
4219,ha star flag pentagram pentagram fivepointed star formed drawing continuous line five straight segment often used mystic magical symbol 
4220,absolutely mind boggling youre right six pointed star default shape m paint racist automatically associate money jew insane 
4221,point people calling racist keep talking kk supporter maybe stay away anything could perceived anti semitic saying 
4222,dont understand trump tweeted tweeted cry loud nevermind democrat party nominee embroiled crminal investigation federal bureau security review trump tweeted god damn 
4223,httpcontentmycutegraphicscomgraphicswesternsheriffbadgepngsee difference 
4224,cant honestly understand id like think whole mishap due dramatically understaffed underfunded campaign idea anymorefrom costbenefit analysis provides nothing campaign whole situation begs response 
4225,httpsyoutubeeksezjstms 
4226,trump tweeted star david damn sure pentagram flag 
4227,mean like pic hillary making klan leader 
4228,see error 
4229,see point said earlier dont think meant antisemitic point many jew unfortable yet reddit trying tell jew comfortable insane many valid concern message real implied magen david even trump team removed 
4230,problem conceding issue people tilting windmill explaining people concern invalid proper course action situation probably changed star backlash doesnt mean original picture way inappropriate 
4231,condescending thing believe 
4232,one always right agree 
4233,well turn original created neonazis reposted trump campaign mic discovered sunday donald trump twitter wasnt first place meme appeared image previously featured pol internet message board altright digital movement neonazis antisemites white supremacist newly emboldened success donald trump rhetoric early june week donald trump team tweeted ithttpsmiccomarticlesdonaldtrumpsstarofdavidhillaryclintonmemewascreatedbywhitesupremacistsjktmpjmj 
4234,one better shooting foot already jammed mouth donald trump 
4235,wow new talking point ridiculous grasping straw ive noticed little green men spurting reddit guess elsewherewapo arbriter good day bad day 
4236,presumptive democratic party nominee interviewed part ongoing large scale fbi investigation either primary target major player presumptive republican party nominee tweet bullshitone news 
4237,literally default fucking m paint shape see yourselfhttpswwgooglecomsearchsitetbmischsourcehpbiwbihqmspaintshapesoqmspaintshapesgslimgijij acimg jfhsfdbheyare play doh shape racist toohttpsiredditbjiwigxxpng apparently google adobe microsoft guilty antisemitism wellhttpstwittercomrogerkinstatus 
4238,get fuckin data label yaxis number million search great seeing relative comparison real number would make way impactful 
4239,donald trumpa legend mind 
4240,fucking care democrat nominee interrogated fbi part criminal investigation trump tweeted shit would hilariious wasnt fucking pathetic 
4241,washington post turn unbaised news day carrying water clinton campaigntrump moron supposed newspaper claiming tie criminal fbi investigation interview stupid star david tweet forgetting hillary colored people time stuff shes involved plenty bigoted racially insensitive stuff 
